title,price,location,surface,rooms,baths,link
Appartement 67 m² à BOUSKOURA prix imbattable,690000,"Appartements dans Casablanca, Autre secteur",67 m²,2 chambres,1 sdb,https://www.avito.ma/fr/autre_secteur/appartements/Appartement_67_m%C2%B2_%C3%A0_BOUSKOURA_prix_imbattable_57595128.htm
Studio de 60 m² à vendre à Marrakech,1140000,"Appartements dans Marrakech, Guéliz",60 m²,1 chambre,1 sdb,https://www.avito.ma/fr/gu%C3%A9liz/appartements/Studio_de_60_m%C2%B2_%C3%A0_vendre_%C3%A0_Marrakech_57765700.htm
Appartement à vendre 76 m² à Sidi Rahal,610000,"Appartements dans Sidi Rahal, Toute la ville",76 m²,3 chambres,2 sdbs,https://www.avito.ma/fr/sidi_rahal/appartements/Appartement_%C3%A0_vendre_76_m%C2%B2_%C3%A0_Sidi_Rahal_57775612.htm
Appartements à vendre de 82 à 94 m² à Tassila,860000,"Appartements dans Agadir, Tassila",appartements à vendre de 82 à 94 m² à tassila,3 chambres,0 sdb,https://www.avito.ma/fr/tassila/appartements/Appartements_%C3%A0_vendre_de_82_%C3%A0_94_m%C2%B2_%C3%A0_Tassila_54250231.htm
Appartement à vendre 105 m² hay el andalos,370000,"Appartements dans Oujda, Andalous",105 m²,3 chambres,2 sdbs,https://www.avito.ma/fr/andalous/appartements/Appartement_%C3%A0_vendre_105_m%C2%B2_hay_el_andalos_57755280.htm
Appartement à vendre 100 m² à route jrada,450000,"Appartements dans Oujda, Route Jerada",appartement à vendre 100 m² à route jrada,3 chambres,1 sdb,https://www.avito.ma/fr/route_jerada/appartements/Appartement_%C3%A0_vendre_100_m%C2%B2_%C3%A0_route_jrada_55095392.htm
Appartement à vendre 3 chambres à Moulay Youssef 119 m²,3000000,"Appartements dans Casablanca, Moulay Youssef",119 m²,3 chambres,2 sdbs,https://www.avito.ma/fr/moulay_youssef/appartements/Appartement_%C3%A0_vendre_3_chambres_%C3%A0_Moulay_Youssef_119_m%C2%B2_57303291.htm
Appartement 100 m² à Oujda,390000,"Appartements dans Oujda, Sidi Yahya",appartement 100 m² à oujda,3 chambres,1 sdb,https://www.avito.ma/fr/sidi_yahya/appartements/Appartement_100_m%C2%B2_%C3%A0_Oujda_54904149.htm
Appartement RDC 91 m2 à Hay Mohammadi,780000,"Appartements dans Casablanca, Hay Mohammadi",91 m²,4 chambres,2 sdbs,https://www.avito.ma/fr/hay_mohammadi/appartements/Appartement_RDC_91_m2_%C3%A0_Hay_Mohammadi_57684858.htm
Elégant Studio à vendre 57 m² à Marrakech,1482000,"Appartements dans Marrakech, Guéliz",57 m²,1 chambre,1 sdb,https://www.avito.ma/fr/gu%C3%A9liz/appartements/El%C3%A9gant_Studio_%C3%A0_vendre_57_m%C2%B2_%C3%A0_Marrakech_57638397.htm
Appartement à vendre 70 m² à Oujda,260000,"Appartements dans Oujda, Route Jerada",70 m²,2 chambres,1 sdb,https://www.avito.ma/fr/route_jerada/appartements/Appartement_%C3%A0_vendre_70_m%C2%B2_%C3%A0_Oujda_57755446.htm
Appartement Neuf de 138 m² à Harhoura,2200000,"Appartements dans Temara, Harhoura",138 m²,2 chambres,2 sdbs,https://www.avito.ma/fr/harhoura/appartements/Appartement_Neuf_de_138_m%C2%B2_%C3%A0_Harhoura_57756712.htm
Appartement à vendre 154 m² à Marrakech,2475000,"Appartements dans Marrakech, Route de Casablanca",154 m²,3 chambres,3 sdbs,https://www.avito.ma/fr/route_de_casablanca/appartements/Appartement_%C3%A0_vendre_154_m%C2%B2_%C3%A0_Marrakech_57804075.htm
Bel appartement à vendre,750000,"Appartements dans Agadir, Hay Salam",,2 chambres,1 sdb,https://www.avito.ma/fr/hay_salam/appartements/Bel_appartement_%C3%A0_vendre_57554092.htm
Appartement 3 chambres à Mimosas Prix imbattable,820000,"Appartements dans Kénitra, Mimosas",106 m²,3 chambres,2 sdbs,https://www.avito.ma/fr/mimosas/appartements/Appartement_3_chambres_%C3%A0_Mimosas_Prix_imbattable_45758846.htm
Appartement à vendre 86 m² à Oujda,380000,"Appartements dans Oujda, Hay zitoune",appartement à vendre 86 m² à oujda,3 chambres,1 sdb,https://www.avito.ma/fr/hay_zitoune/appartements/Appartement_%C3%A0_vendre_86_m%C2%B2_%C3%A0_Oujda_54393319.htm
Appart meublé 2ch salon balcon 91m2 à vendre La Gironde,950000,"Appartements dans Casablanca, La Gironde",91 m²,2 chambres,2 sdbs,https://www.avito.ma/fr/la_gironde/appartements/Appart_meubl%C3%A9_2ch_salon_balcon_91m2_%C3%A0_vendre_La_Gironde_57823689.htm
Appartement 120 millions,1200000,"Appartements dans Rabat, Riyad Extension",76 m²,2 chambres,2 sdbs,https://www.avito.ma/fr/riyad_extension/appartements/Appartement_120_millions_57807485.htm
Appartement vide à vendre quartier Badia,850000,"Appartements dans Marrakech, Ancienne Médina",62 m²,2 chambres,1 sdb,https://www.avito.ma/fr/ancienne_m%C3%A9dina/appartements/Appartement_vide_%C3%A0_vendre_quartier_Badia_57639180.htm
Appart HS 3ch sal terse 127m2 à vendre Mers sultan,1400000,"Appartements dans Casablanca, Mers Sultan",127 m²,3 chambres,2 sdbs,https://www.avito.ma/fr/mers_sultan/appartements/Appart_HS_3ch_sal_terse_127m2_%C3%A0_vendre_Mers_sultan_57601103.htm
Appartement de luxe à vendre à Branes 2,1350000,"Appartements dans Tanger, Branes 2",,2 chambres,2 sdbs,https://www.avito.ma/fr/branes_2/appartements/Appartement_de_luxe_%C3%A0_vendre_%C3%A0_Branes_2_57496734.htm
Appartement à vendre à Casablanca Arrahma,580000,"Appartements dans Casablanca, Errahma",67 m²,2 chambres,2 sdbs,https://www.avito.ma/fr/errahma/appartements/Appartement_%C3%A0_vendre_%C3%A0_Casablanca_Arrahma_57707716.htm
Appartement à vendre 121 m² à Temara,1210000,"Appartements dans Temara, Autre secteur",appartement à vendre 121 m² à temara,3 chambres,2 sdbs,https://www.avito.ma/fr/autre_secteur/appartements/Appartement_%C3%A0_vendre_121_m%C2%B2_%C3%A0_Temara_57725988.htm
Appartement à vendre 100²m à Oujda,380000,"Appartements dans Oujda, Autre secteur",,4 chambres,1 sdb,https://www.avito.ma/fr/autre_secteur/appartements/Appartement_%C3%A0_vendre_100%C2%B2m_%C3%A0_Oujda_54393399.htm
Bel appartement à vendre,,"Appartements dans Mohammedia, Al Qods",148 m²,3 chambres,2 sdbs,https://www.avito.ma/fr/al_qods/appartements/Bel_appartement_%C3%A0_vendre_57722083.htm
Appartement à vendre à Temara,1200000,"Appartements dans Rabat, Autre secteur",107 m²,3 chambres,2 sdbs,https://www.avito.ma/fr/autre_secteur/appartements/Appartement_%C3%A0_vendre_%C3%A0_Temara_57812272.htm
Appartement à vendre 105 m² El Andalous,370000,"Appartements dans Oujda, Andalous",105 m²,2 chambres,2 sdbs,https://www.avito.ma/fr/andalous/appartements/Appartement_%C3%A0_vendre_105_m%C2%B2_El_Andalous_57755402.htm
Appartement à vendre 65 m Mdiq 4 min à pied plage,480000,"Appartements dans Mdiq, Toute la ville",60 m²,2 chambres,1 sdb,https://www.avito.ma/fr/mdiq/appartements/Appartement_%C3%A0_vendre_65_m_Mdiq_4_min_%C3%A0_pied_plage_57822237.htm
Appt à ne pas rater,590000,"Appartements dans Fès, Route Ain Chkaf",100 m²,2 chambres,1 sdb,https://www.avito.ma/fr/route_ain_chkaf/appartements/Appt_%C3%A0_ne_pas_rater_57132071.htm
Appartement à vendre au 1er étage à Tamaris Aqua-parc,360000,"Appartements dans Tamaris, Toute la ville",,2 chambres,1 sdb,https://www.avito.ma/fr/tamaris/appartements/Appartement_%C3%A0_vendre_au_1er_%C3%A9tage_%C3%A0_Tamaris_Aqua_parc_51522778.htm
Appartement à vendre 130 m² à plage des nations,1850000,"Appartements dans Sidi Bouknadel, Toute la ville",130 m²,2 chambres,2 sdbs,https://www.avito.ma/fr/sidi_bouknadel/appartements/Appartement_%C3%A0_vendre_130_m%C2%B2_%C3%A0_plage_des_nations_56055121.htm
Appartement à vendre 110 m² à Casablanca,1700000,"Appartements dans Casablanca, 2 Mars",110 m²,3 chambres,2 sdbs,https://www.avito.ma/fr/2_mars/appartements/Appartement_%C3%A0_vendre_110_m%C2%B2_%C3%A0_Casablanca_57775489.htm
Superbe Appart à vendre à Ain Diab Extension,4000000,"Appartements dans Casablanca, Aïn Diab",189 m²,3 chambres,2 sdbs,https://www.avito.ma/fr/a%C3%AFn_diab/appartements/Superbe_Appart_%C3%A0_vendre_%C3%A0_Ain_Diab_Extension_57770131.htm
Appartement à vendre 92 m² à Meknès,,"Appartements dans Meknès, Hamria",92 m²,2 chambres,2 sdbs,https://www.avito.ma/fr/hamria/appartements/Appartement_%C3%A0_vendre_92_m%C2%B2_%C3%A0_Mekn%C3%A8s_57839593.htm
Appartement à vendre 100 m² à Tétouan,1245000,"Appartements dans Tétouan, Autre secteur",110 m²,3 chambres,2 sdbs,https://www.avito.ma/fr/autre_secteur/appartements/Appartement_%C3%A0_vendre_100_m%C2%B2_%C3%A0_T%C3%A9touan_57616531.htm
Appartement à vendre 211 m² à Tanger Malabata Hils,,"Appartements dans Tanger, Malabata",211 m²,4 chambres,3 sdbs,https://www.avito.ma/fr/malabata/appartements/Appartement_%C3%A0_vendre_211_m%C2%B2_%C3%A0_Tanger_Malabata_Hils_57086129.htm
Appartement à vendre 58 m² à Martil,,"Appartements dans Martil, Toute la ville",56 m²,1 chambre,1 sdb,https://www.avito.ma/fr/martil/appartements/Appartement_%C3%A0_vendre_58_m%C2%B2_%C3%A0_Martil_56716790.htm
Appartement 72 m² à Vendre à Casa Sidi Maarouf,,"Appartements dans Casablanca, Sidi Maarouf",99 m²,2 chambres,2 sdbs,https://www.avito.ma/fr/sidi_maarouf/appartements/Appartement_72_m%C2%B2_%C3%A0_Vendre_%C3%A0_Casa_Sidi_Maarouf_55838745.htm
Appartement à vendre à Sonaba,2200000,"Appartements dans Agadir, Founty",,3 chambres,2 sdbs,https://www.avito.ma/fr/founty/appartements/Appartement_%C3%A0_vendre_%C3%A0_Sonaba_57486945.htm
Super Appartement Vue sur Mer à Dar Bouazza,2390000,"Appartements dans Dar Bouazza, Toute la ville",132 m²,3 chambres,2 sdbs,https://www.avito.ma/fr/dar_bouazza/appartements/Super_Appartement_Vue_sur_Mer_%C3%A0_Dar_Bouazza_57692835.htm
Appartement à vendre 78 m² à Marrakech,,"Appartements dans Marrakech, Guéliz",78 m²,2 chambres,2 sdbs,https://www.avito.ma/fr/gu%C3%A9liz/appartements/Appartement_%C3%A0_vendre_78_m%C2%B2_%C3%A0_Marrakech_53243419.htm
Appartement Oulad mtaa,,"Appartements dans Rabat, Riyad Extension",119 m²,3 chambres,3 sdbs,https://www.avito.ma/fr/riyad_extension/appartements/Appartement_Oulad_mtaa_57807474.htm
Appartement à vendre 90m² à Oujda ziton,370000,"Appartements dans Oujda, Hay zitoune",appartement à vendre 90m² à oujda ziton,2 chambres,1 sdb,https://www.avito.ma/fr/hay_zitoune/appartements/Appartement_%C3%A0_vendre_90m%C2%B2_%C3%A0_Oujda_ziton_56030009.htm
Appartement à vendre pas de semsar,600000,"Appartements dans Mohammedia, Nassim",70 m²,2 chambres,1 sdb,https://www.avito.ma/fr/nassim/appartements/Appartement_%C3%A0_vendre_pas_de_semsar_57773761.htm
Appartement de Luxe 209 m² Malabata hills Tanger,,"Appartements dans Tanger, Malabata",209 m²,3 chambres,3 sdbs,https://www.avito.ma/fr/malabata/appartements/Appartement_de_Luxe_209_m%C2%B2_Malabata_hills_Tanger_57263583.htm
Appartement à vendre Bourgogne,1200000,"Appartements dans Casablanca, Bourgogne",90 m²,2 chambres,2 sdbs,https://www.avito.ma/fr/bourgogne/appartements/Appartement_%C3%A0_vendre_Bourgogne_57697496.htm
Appartement à vendre 80 m² à Oujda,460000,"Appartements dans Oujda, Centre Ville",appartement à vendre 80 m² à oujda,2 chambres,1 sdb,https://www.avito.ma/fr/centre_ville/appartements/Appartement_%C3%A0_vendre_80_m%C2%B2_%C3%A0_Oujda_54393862.htm
Appartement à vendre 147 m² à Bd Fouaratte Casa.,1200000,"Appartements dans Casablanca, Hay Mohammadi",147 m²,4 chambres,3 sdbs,https://www.avito.ma/fr/hay_mohammadi/appartements/Appartement_%C3%A0_vendre_147_m%C2%B2_%C3%A0_Bd_Fouaratte_Casa__56185859.htm
Appartement à vendre 100 m² à Oujda,460000,"Appartements dans Oujda, Hay zitoune",appartement à vendre 100 m² à oujda,3 chambres,2 sdbs,https://www.avito.ma/fr/hay_zitoune/appartements/Appartement_%C3%A0_vendre_100_m%C2%B2_%C3%A0_Oujda_54904183.htm
Appartement à Atlas golf Resort à Marrakech,2100000,"Appartements dans Marrakech, Annakhil",140 m²,2 chambres,2 sdbs,https://www.avito.ma/fr/annakhil/appartements/Appartement_%C3%A0_Atlas_golf_Resort_%C3%A0_Marrakech_57615030.htm
Appart 3ch 2sa blc 150m2 à vendre 2Mars,2200000,"Appartements dans Casablanca, 2 Mars",150 m²,3 chambres,2 sdbs,https://www.avito.ma/fr/2_mars/appartements/Appart_3ch_2sa_blc_150m2_%C3%A0_vendre_2Mars_56889308.htm
Spacieux appartement à vendre meublé,1350000,"Appartements dans Marrakech, Victor Hugo",54 m²,1 chambre,1 sdb,https://www.avito.ma/fr/victor_hugo/appartements/Spacieux_appartement_%C3%A0_vendre_meubl%C3%A9_57711710.htm
Résidence de standing vue océan,1885000,"Appartements dans Dar Bouazza, Toute la ville",,4 chambres,3 sdbs,https://www.avito.ma/fr/dar_bouazza/appartements/R%C3%A9sidence_de_standing_vue_oc%C3%A9an_57780448.htm
Appartement à vendre 75 m² à Oujda,270000,"Appartements dans Oujda, Autre secteur",appartement à vendre 75 m² à oujda,4 chambres,1 sdb,https://www.avito.ma/fr/autre_secteur/appartements/Appartement_%C3%A0_vendre_75_m%C2%B2_%C3%A0_Oujda_55095473.htm
Saidia AP2 - Appart de 118m² – proche du Golf,960000,"Appartements dans Saidia, Toute la ville",118 m²,2 chambres,2 sdbs,https://www.avito.ma/fr/saidia/appartements/Saidia_AP2___Appart_de_118m%C2%B2___proche_du_Golf_57775425.htm
"Appartement à vendre 181 m² avec terrasse, Racine",3100000,"Appartements dans Casablanca, Racine",181 m²,3 chambres,3 sdbs,https://www.avito.ma/fr/racine/appartements/Appartement_%C3%A0_vendre_181_m%C2%B2_avec_terrasse__Racine_57800891.htm
Appartement à vendre 89m² à H M Casablanca,850000,"Appartements dans Casablanca, Hay Mohammadi",89 m²,2 chambres,2 sdbs,https://www.avito.ma/fr/hay_mohammadi/appartements/Appartement_%C3%A0_vendre_89m%C2%B2_%C3%A0_H_M_Casablanca_55797652.htm
Appartement à vendre 74 m² à Oujda,350000,"Appartements dans Oujda, Hay zitoune",appartement à vendre 74 m² à oujda,2 chambres,1 sdb,https://www.avito.ma/fr/hay_zitoune/appartements/Appartement_%C3%A0_vendre_74_m%C2%B2_%C3%A0_Oujda_54392874.htm
Rez de jardin à vendre 107 m² vue sur piscine,1900000,"Appartements dans Marrakech, Route de Casablanca",107 m²,2 chambres,2 sdbs,https://www.avito.ma/fr/route_de_casablanca/appartements/Rez_de_jardin_%C3%A0_vendre_107_m%C2%B2_vue_sur_piscine_57648716.htm
Appartement 100 m² à Oujda,470000,"Appartements dans Oujda, Centre Ville",appartement 100 m² à oujda,3 chambres,1 sdb,https://www.avito.ma/fr/centre_ville/appartements/Appartement_100_m%C2%B2_%C3%A0_Oujda_56030081.htm
Appartement à vendre Tanger Centre Ville,275000000,"Appartements dans Tanger, Centre ville",,3 chambres,3 sdbs,https://www.avito.ma/fr/centre_ville/appartements/Appartement_%C3%A0_vendre_Tanger_Centre_Ville_57839555.htm
Appartements à vendre lotissement Al Dha.,390000,"Appartements dans Laâyoune, Toute la ville",86 m²,2 chambres,1 sdb,https://www.avito.ma/fr/la%C3%A2youne/appartements/Appartements_%C3%A0_vendre_lotissement_Al_Dha__57697598.htm
Appartement 83m² salon 3ch à vendre Hay Adil Casa,620000,"Appartements dans Casablanca, Hay Mohammadi",appartement 83m² salon 3ch à vendre hay adil casa,3 chambres,1 sdb,https://www.avito.ma/fr/hay_mohammadi/appartements/Appartement_83m%C2%B2_salon_3ch_%C3%A0_vendre_Hay_Adil_Casa_55959045.htm
Appartement à vendre CGI redéhousse,320000,"Appartements dans Oujda, CGI",,2 chambres,1 sdb,https://www.avito.ma/fr/cgi/appartements/Appartement_%C3%A0_vendre_CGI_red%C3%A9housse_55224256.htm
Appartement à vendre Haut standing,,"Appartements dans Rabat, Hay Riad",156 m²,4 chambres,3 sdbs,https://www.avito.ma/fr/hay_riad/appartements/Appartement_%C3%A0_vendre_Haut_standing_57781042.htm
Appartement à vendre 150 m² à Agadir,1900000,"Appartements dans Agadir, Haut-Founty",150 m²,4 chambres,2 sdbs,https://www.avito.ma/fr/haut_founty/appartements/Appartement_%C3%A0_vendre_150_m%C2%B2_%C3%A0_Agadir_57712745.htm
Appartement à vendre 90 m² à Oujda,290000,"Appartements dans Oujda, Agdal",130 m²,3 chambres,1 sdb,https://www.avito.ma/fr/agdal/appartements/Appartement_%C3%A0_vendre_90_m%C2%B2_%C3%A0_Oujda_57359130.htm
Appartement à vendre 58 m Mdiq 4 min à pied plage,490000,"Appartements dans Mdiq, Toute la ville",58 m²,2 chambres,1 sdb,https://www.avito.ma/fr/mdiq/appartements/Appartement_%C3%A0_vendre_58_m_Mdiq_4_min_%C3%A0_pied_plage_57822302.htm
Appartement à vendre,950000,"Appartements dans Tanger, Centre",75 m²,2 chambres,1 sdb,https://www.avito.ma/fr/centre/appartements/Appartement_%C3%A0_vendre_57799376.htm
Appartement à vendre 124m² Roche Noire Casablanca,1050000,"Appartements dans Casablanca, Roches Noires",124 m²,2 chambres,2 sdbs,https://www.avito.ma/fr/roches_noires/appartements/Appartement_%C3%A0_vendre_124m%C2%B2_Roche_Noire_Casablanca_54971172.htm
Appartement 1er chouka à vendre 50m² ERRAHMA Casa,350000,"Appartements dans Casablanca, Errahma",50 m²,2 chambres,1 sdb,https://www.avito.ma/fr/errahma/appartements/Appartement_1er_chouka_%C3%A0_vendre_50m%C2%B2_ERRAHMA_Casa_56040509.htm
Appartement à vendre 80 m² à Oujda,400000,"Appartements dans Oujda, Centre Ville",appartement à vendre 80 m² à oujda,2 chambres,1 sdb,https://www.avito.ma/fr/centre_ville/appartements/Appartement_%C3%A0_vendre_80_m%C2%B2_%C3%A0_Oujda_54392947.htm
APPART 91m 2FACES vue piscine à MARBELLA BEACH,1030000,"Appartements dans Mohammedia, Autre secteur",91 m²,2 chambres,2 sdbs,https://www.avito.ma/fr/autre_secteur/appartements/APPART_91m_2FACES_vue_piscine_%C3%A0_MARBELLA_BEACH_57747136.htm
Appartement 98m² chouka à vendre Fouarat Casa,950000,"Appartements dans Casablanca, Hay Mohammadi",147 m²,3 chambres,1 sdb,https://www.avito.ma/fr/hay_mohammadi/appartements/Appartement_98m%C2%B2_chouka_%C3%A0_vendre_Fouarat_Casa_56770374.htm
Appartement vide à vendre sur la Route de Rabat,1232500,"Appartements dans Tanger, Autre secteur",,3 chambres,2 sdbs,https://www.avito.ma/fr/autre_secteur/appartements/Appartement_vide_%C3%A0_vendre_sur_la_Route_de_Rabat_56652097.htm
Appartement 138m² au 2ème étg au Maârif,1800000,"Appartements dans Casablanca, Maarif",138 m²,3 chambres,3 sdbs,https://www.avito.ma/fr/maarif/appartements/Appartement_138m%C2%B2_au_2%C3%A8me_%C3%A9tg_au_Ma%C3%A2rif_55941961.htm
Appartement d’exception front mer- Tamaris Premium,2000000,"Appartements dans Tamaris, Toute la ville",117 m²,2 chambres,1 sdb,https://www.avito.ma/fr/tamaris/appartements/Appartement_d_exception_front_mer__Tamaris_Premium_57728469.htm
"Appartement 124 m² – Centre Ville, Tanger",1800000,"Appartements dans Tanger, Centre ville",124 m²,3 chambres,2 sdbs,https://www.avito.ma/fr/centre_ville/appartements/Appartement_124_m%C2%B2___Centre_Ville__Tanger_57723798.htm
Appartement à vendre 145 m² à la marina casablanca,3900000,"Appartements dans Tanger, Autre secteur",155 m²,2 chambres,3 sdbs,https://www.avito.ma/fr/autre_secteur/appartements/Appartement_%C3%A0_vendre_145_m%C2%B2_%C3%A0_la_marina_casablanca_56472283.htm
Appartement à vendre CGI à Oujda,330000,"Appartements dans Oujda, CGI",,5 chambres,1 sdb,https://www.avito.ma/fr/cgi/appartements/Appartement_%C3%A0_vendre_CGI_%C3%A0_Oujda_54393879.htm
Appartement à vendre 110 m2 à Saïdia,750000,"Appartements dans Saidia, Toute la ville",110 m²,2 chambres,1 sdb,https://www.avito.ma/fr/saidia/appartements/Appartement_%C3%A0_vendre_110_m2_%C3%A0_Sa%C3%AFdia_57839494.htm
Appartement R+2 bien ensoleillé,370000,"Appartements dans El Jadida, Autre secteur",,2 chambres,1 sdb,https://www.avito.ma/fr/autre_secteur/appartements/Appartement_R_2_bien_ensoleill%C3%A9_56760810.htm
Appartement à Bouznika,10,"Appartements dans Bouznika, Autre secteur",65 m²,2 chambres,1 sdb,https://www.avito.ma/fr/autre_secteur/appartements/Appartement_%C3%A0_Bouznika_57839490.htm
Appartement à vendre 71 m² à Bouznika,600000,"Appartements dans Bouznika, Autre secteur",71 m²,2 chambres,1 sdb,https://www.avito.ma/fr/autre_secteur/appartements/Appartement_%C3%A0_vendre_71_m%C2%B2_%C3%A0_Bouznika_56368488.htm
À vendre un joli appartement meublé avec piscine,1250000,"Appartements dans El Mansouria, Toute la ville",92 m²,2 chambres,2 sdbs,https://www.avito.ma/fr/el_mansouria/appartements/%C3%80_vendre_un_joli_appartement_meubl%C3%A9_avec_piscine_56846634.htm
Appartement à vendre 134 m² à Tanger,2546000,"Appartements dans Tanger, De La Plage",134 m²,3 chambres,2 sdbs,https://www.avito.ma/fr/de_la_plage/appartements/Appartement_%C3%A0_vendre_134_m%C2%B2_%C3%A0_Tanger_56300463.htm
Appartement à vendre 85 m² à Oujda,3700000,"Appartements dans Oujda, Centre Ville",appartement à vendre 85 m² à oujda,2 chambres,1 sdb,https://www.avito.ma/fr/centre_ville/appartements/Appartement_%C3%A0_vendre_85_m%C2%B2_%C3%A0_Oujda_54489101.htm
Appartement à vendre 100 m² à Oujda hay ziton,440000,"Appartements dans Oujda, Hay zitoune",appartement à vendre 100 m² à oujda hay ziton,3 chambres,1 sdb,https://www.avito.ma/fr/hay_zitoune/appartements/Appartement_%C3%A0_vendre_100_m%C2%B2_%C3%A0_Oujda_hay_ziton_54393530.htm
Appartement à vendre 85 m² à Oujda,380000,"Appartements dans Oujda, Centre Ville",appartement à vendre 85 m² à oujda,2 chambres,1 sdb,https://www.avito.ma/fr/centre_ville/appartements/Appartement_%C3%A0_vendre_85_m%C2%B2_%C3%A0_Oujda_54663434.htm
Aptmts neuf à hay riyad,3400000,"Appartements dans Rabat, Hay Riad",120 m²,3 chambres,1 sdb,https://www.avito.ma/fr/hay_riad/appartements/Aptmts_neuf_%C3%A0_hay_riyad_57457147.htm
Appartement à vendre 80m2 à Saïdia,590000,"Appartements dans Saidia, Toute la ville",80 m²,2 chambres,2 sdbs,https://www.avito.ma/fr/saidia/appartements/Appartement_%C3%A0_vendre_80m2_%C3%A0_Sa%C3%AFdia_57839472.htm
Appartement neuf à vendre 72m² aux princesses,1600000,"Appartements dans Casablanca, Les Princesses",appartement neuf à vendre 72m² aux princesses,2 chambres,2 sdbs,https://www.avito.ma/fr/les_princesses/appartements/Appartement_neuf_%C3%A0_vendre_72m%C2%B2_aux_princesses_57290444.htm
Appartement à vendre 80 m² à Oujda,270000,"Appartements dans Oujda, Agdal",appartement à vendre 80 m² à oujda,3 chambres,1 sdb,https://www.avito.ma/fr/agdal/appartements/Appartement_%C3%A0_vendre_80_m%C2%B2_%C3%A0_Oujda_57600721.htm
Appartement à vendre 95 m² à Marrakech palmeraie,1500000,"Appartements dans Marrakech, Palmeraie",95 m²,2 chambres,2 sdbs,https://www.avito.ma/fr/palmeraie/appartements/Appartement_%C3%A0_vendre_95_m%C2%B2_%C3%A0_Marrakech_palmeraie_57216492.htm
A vendre un appartement avec terrasse,3750000,"Appartements dans Casablanca, Racine",190 m²,4 chambres,3 sdbs,https://www.avito.ma/fr/racine/appartements/A_vendre_un_appartement_avec_terrasse_57516868.htm
Appartement RDC de 3 chbrs à vendre sur Agadir,,"Appartements dans Agadir, Hay Mohammadi",,3 chambres,2 sdbs,https://www.avito.ma/fr/hay_mohammadi/appartements/Appartement_RDC_de_3_chbrs_%C3%A0_vendre_sur_Agadir_57651556.htm
Appartement à vendre 90 m² à Oujda,370000,"Appartements dans Oujda, Sidi Yahya",appartement à vendre 90 m² à oujda,3 chambres,2 sdbs,https://www.avito.ma/fr/sidi_yahya/appartements/Appartement_%C3%A0_vendre_90_m%C2%B2_%C3%A0_Oujda_54904207.htm
Studios neufs à vendre à HERMITAGE,960000,"Appartements dans Casablanca, Hermitage",,1 chambre,1 sdb,https://www.avito.ma/fr/hermitage/appartements/Studios_neufs_%C3%A0_vendre_%C3%A0_HERMITAGE_55079135.htm
Joli Studio 68 m² proche des Jardins Majorelle,1190000,"Appartements dans Marrakech, Majorelle",68 m²,1 chambre,1 sdb,https://www.avito.ma/fr/majorelle/appartements/Joli_Studio_68_m%C2%B2_proche_des_Jardins_Majorelle_57646076.htm
🌿 Appartement d’exception à vendre à Achakar,2800000,"Appartements dans Tanger, Achakar",165 m²,2 chambres,2 sdbs,https://www.avito.ma/fr/achakar/appartements/___Appartement_d_exception_%C3%A0_vendre_%C3%A0_Achakar__57717771.htm
Appartement à vendre à Tétouan Chebar,580000,"Appartements dans Martil, Toute la ville",80 m²,2 chambres,1 sdb,https://www.avito.ma/fr/martil/appartements/Appartement_%C3%A0_vendre_%C3%A0_T%C3%A9touan_Chebar_57839437.htm
Appartement 165m² RDC à vendre 2 Mars Casablanca,1540000,"Appartements dans Casablanca, 2 Mars",35 m²,4 chambres,2 sdbs,https://www.avito.ma/fr/2_mars/appartements/Appartement_165m%C2%B2__RDC_%C3%A0_vendre__2_Mars_Casablanca_56040548.htm
À vendre appartement 3 CH avec terrasse de 44m2,2350000,"Appartements dans Casablanca, Ferme Bretone",144 m²,3 chambres,3 sdbs,https://www.avito.ma/fr/ferme_bretone/appartements/%C3%80_vendre_appartement_3_CH_avec_terrasse_de_44m2_57406538.htm
"Appartements prêts à vendre, différentes superficies à ""Laâouama""",9000,"Appartements dans Tanger, Autre secteur",86 m²,3 chambres,2 sdbs,https://www.avito.ma/fr/autre_secteur/appartements/Appartements_pr%C3%AAts_%C3%A0_vendre__diff%C3%A9rentes_superficies_%C3%A0__La%C3%A2ouama__57839449.htm
Appartement à vendre 150 m² à Oujda,490000,"Appartements dans Oujda, Sidi Yahya",appartement à vendre 150 m² à oujda,3 chambres,1 sdb,https://www.avito.ma/fr/sidi_yahya/appartements/Appartement_%C3%A0_vendre_150_m%C2%B2_%C3%A0_Oujda_55361733.htm
Appartement à vendre 50 m² à Tamaris,280000,"Appartements dans Tamaris, Toute la ville",appartement à vendre 50 m² à tamaris,2 chambres,1 sdb,https://www.avito.ma/fr/tamaris/appartements/Appartement_%C3%A0_vendre_50_m%C2%B2_%C3%A0_Tamaris_56939136.htm
Appartement à à Plage des Nations,2500000,"Appartements dans Sidi Bouknadel, Toute la ville",98 m²,2 chambres,2 sdbs,https://www.avito.ma/fr/sidi_bouknadel/appartements/Appartement_%C3%A0_%C3%A0_Plage_des_Nations_57513939.htm
Super Appartement neuf à vendre H M Casa,920000,"Appartements dans Casablanca, Hay Mohammadi",92 m²,2 chambres,2 sdbs,https://www.avito.ma/fr/hay_mohammadi/appartements/Super_Appartement_neuf_%C3%A0_vendre_H_M_Casa_56729735.htm
Appartement 120m² Chouka à vendre à Casablanca.,1080000,"Appartements dans Casablanca, Hay Mohammadi",120 m²,3 chambres,2 sdbs,https://www.avito.ma/fr/hay_mohammadi/appartements/Appartement_120m%C2%B2_Chouka_%C3%A0_vendre_%C3%A0_Casablanca__56464823.htm
Appartement 85 m² à Oujda redchousse ban9achoure,400000,"Appartements dans Oujda, Centre Ville",appartement 85 m² à oujda redchousse ban9achoure,2 chambres,1 sdb,https://www.avito.ma/fr/centre_ville/appartements/Appartement_85_m%C2%B2_%C3%A0_Oujda_redchousse_ban9achoure_55224195.htm
