title,price,location,surface,rooms,baths,link
À VENDRE Bel appartement moderne 55m² à Belvédère,730000,"Appartements dans Casablanca, Belvédère",55 m²,1 chambre,1 sdb,https://www.avito.ma/fr/belv%C3%A9d%C3%A8re/appartements/%C3%80_VENDRE_Bel_appartement_moderne_55m%C2%B2_%C3%A0_Belv%C3%A9d%C3%A8re_57838866.htm
Appartement à vendre 118 m² à Tanger,1750000,"Appartements dans Tanger, Centre ville",appartement à vendre 118 m² à tanger,2 chambres,2 sdbs,https://www.avito.ma/fr/centre_ville/appartements/Appartement_%C3%A0_vendre_118_m%C2%B2_%C3%A0_Tanger_57323592.htm
Appartement à vendre à SAÏDIA 2 façades,,"Appartements dans Saidia, Toute la ville",,2 chambres,1 sdb,https://www.avito.ma/fr/saidia/appartements/Appartement_%C3%A0_vendre_%C3%A0_SA%C3%8FDIA_2_fa%C3%A7ades_41196175.htm
Appartement à vendre 130 m² à Tanger,2650000,"Appartements dans Tanger, Malabata",appartement à vendre 130 m² à tanger,3 chambres,2 sdbs,https://www.avito.ma/fr/malabata/appartements/Appartement_%C3%A0_vendre_130_m%C2%B2_%C3%A0_Tanger_57320669.htm
Investissez dans l'hyper centre Casablancais,1430000,"Appartements dans Casablanca, Centre Ville",,2 chambres,2 sdbs,https://www.avito.ma/fr/centre_ville/appartements/Investissez_dans_l_hyper_centre_Casablancais_57719953.htm
Appartement chouka à Kénitra,610000,"Appartements dans Kénitra, Ouled Oujih",80 m²,2 chambres,2 sdbs,https://www.avito.ma/fr/ouled_oujih/appartements/Appartement_chouka_%C3%A0_K%C3%A9nitra_57737886.htm
Appartement à vendre 43 m² à bourgogne,1300000,"Appartements dans Casablanca, Bourgogne",43 m²,1 chambre,1 sdb,https://www.avito.ma/fr/bourgogne/appartements/Appartement_%C3%A0_vendre_43_m%C2%B2_%C3%A0_bourgogne_57526960.htm
Appartement à vendre 97 m² à Marrakech,2330000,"Appartements dans Marrakech, Guéliz",97 m²,2 chambres,1 sdb,https://www.avito.ma/fr/gu%C3%A9liz/appartements/Appartement_%C3%A0_vendre_97_m%C2%B2_%C3%A0_Marrakech_57658733.htm
Appartement à vendre 82 m² à Kénitra,390000,"Appartements dans Kénitra, Bir Rami",82 m²,2 chambres,2 sdbs,https://www.avito.ma/fr/bir_rami/appartements/Appartement_%C3%A0_vendre_82_m%C2%B2_%C3%A0_K%C3%A9nitra_57694418.htm
"Appartement à vendre Saada, près de Marjane, route de Casa, en sous-sol",440000,"Appartements dans Marrakech, Es Saada",60 m²,2 chambres,1 sdb,https://www.avito.ma/fr/es_saada/appartements/Appartement_%C3%A0_vendre_Saada__pr%C3%A8s_de_Marjane__route_de_Casa__en_sous_sol_57202899.htm
🏡 Appartement à vendre,1900000,"Appartements dans Marrakech, Guéliz",,2 chambres,2 sdbs,https://www.avito.ma/fr/gu%C3%A9liz/appartements/___Appartement_%C3%A0_vendre_57274849.htm
Appartement à vendre avec piscine et parking,1442000,"Appartements dans Tanger, Tanja Balia",,2 chambres,2 sdbs,https://www.avito.ma/fr/tanja_balia/appartements/Appartement_%C3%A0_vendre_avec_piscine_et_parking_55906870.htm
Appartements à vendre surfaces 79/69/85,9000,"Appartements dans Salé, Sidi Abdellah",79 m²,2 chambres,2 sdbs,https://www.avito.ma/fr/sidi_abdellah/appartements/Appartements_%C3%A0_vendre_surfaces_79_69_85_57838847.htm
Studio à vendre 33m² à Palmier,970000,"Appartements dans Casablanca, Palmier",studio à vendre 33m² à palmier,1 chambre,1 sdb,https://www.avito.ma/fr/palmier/appartements/Studio_%C3%A0_vendre_33m%C2%B2_%C3%A0_Palmier_57737757.htm
Studio à vendre 65 m² Proche CFC / Cheikh Khalifa,,"Appartements dans Casablanca, Oulfa",77 m²,1 chambre,1 sdb,https://www.avito.ma/fr/oulfa/appartements/Studio_%C3%A0_vendre_65_m%C2%B2_Proche_CFC___Cheikh_Khalifa_57698934.htm
Appartement à vendre 100m² à Bourgogne Mobilia,1650000,"Appartements dans Casablanca, Bourgogne",appartement à vendre 100m² à bourgogne mobilia,2 chambres,2 sdbs,https://www.avito.ma/fr/bourgogne/appartements/Appartement_%C3%A0_vendre_100m%C2%B2_%C3%A0_Bourgogne_Mobilia_57752033.htm
Beau Studio Avec Grande Terrasse Guéliz,1650000,"Appartements dans Marrakech, Guéliz",,1 chambre,0 sdb,https://www.avito.ma/fr/gu%C3%A9liz/appartements/Beau_Studio_Avec_Grande_Terrasse_Gu%C3%A9liz_57771784.htm
Studio 43m Haut de Gamme Proche Tram,1000000,"Appartements dans Casablanca, 2 Mars",43 m²,1 chambre,1 sdb,https://www.avito.ma/fr/2_mars/appartements/Studio_43m_Haut_de_Gamme_Proche_Tram_57721374.htm
Appartement neuf et moderne sur la corniche,1700000,"Appartements dans Tanger, Malabata",100 m²,2 chambres,2 sdbs,https://www.avito.ma/fr/malabata/appartements/Appartement_neuf_et_moderne_sur_la_corniche_57703995.htm
appartement quartier oulfa,1300000,"Appartements dans Casablanca, Oulfa",144 m²,2 chambres,1 sdb,https://www.avito.ma/fr/oulfa/appartements/appartement_quartier_oulfa_57522572.htm
"Appartement 2 façades, 3ème étage, Iris",650000,"Appartements dans Oujda, Iris",75 m²,2 chambres,1 sdb,https://www.avito.ma/fr/iris/appartements/Appartement_2_fa%C3%A7ades__3%C3%A8me_%C3%A9tage__Iris_57803662.htm
Appartement à vendre à Oued Laou Mekkad,860000,"Appartements dans Oued Laou, Toute la ville",85 m²,2 chambres,1 sdb,https://www.avito.ma/fr/oued_laou/appartements/Appartement_%C3%A0_vendre_%C3%A0_Oued_Laou_Mekkad_57838840.htm
Appartement à vendre 92 m² Espace dubai à Inzegan,1012000,"Appartements dans Inzegan, Toute la ville",92 m²,3 chambres,1 sdb,https://www.avito.ma/fr/inzegan/appartements/Appartement_%C3%A0_vendre_92_m%C2%B2_Espace_dubai_%C3%A0_Inzegan_56449562.htm
Appartement Neuf À Vendre En Plein Cœur De Guéliz,1200000,"Appartements dans Marrakech, Guéliz",,1 chambre,1 sdb,https://www.avito.ma/fr/gu%C3%A9liz/appartements/Appartement_Neuf_%C3%80_Vendre_En_Plein_C_ur_De_Gu%C3%A9liz_57237204.htm
Appartement meublé à vendre Hay Azdihar,560000,"Appartements dans Marrakech, Hay Izdihar",60 m²,2 chambres,1 sdb,https://www.avito.ma/fr/hay_izdihar/appartements/Appartement_meubl%C3%A9_%C3%A0_vendre_Hay_Azdihar_57758375.htm
"Appartement à vendre près de la mer, Marina Agadir",2100000,"Appartements dans Agadir, Agadir Oufella",,2 chambres,2 sdbs,https://www.avito.ma/fr/agadir_oufella/appartements/Appartement_%C3%A0_vendre_pr%C3%A8s_de_la_mer__Marina_Agadir_57641567.htm
Appartement à vendre 75 m² à Kénitra,390000,"Appartements dans Kénitra, Bir Rami",75 m²,2 chambres,2 sdbs,https://www.avito.ma/fr/bir_rami/appartements/Appartement_%C3%A0_vendre_75_m%C2%B2_%C3%A0_K%C3%A9nitra_57694379.htm
Appartements modernes et intelligents de haute qualité,,"Appartements dans Tétouan, Centre ville",,3 chambres,2 sdbs,https://www.avito.ma/fr/centre_ville/appartements/Appartements_modernes_et_intelligents_de_haute_qualit%C3%A9_56072658.htm
Appartement à vendre 145 m² à la marina casablanca,3900000,"Appartements dans Tanger, Autre secteur",155 m²,2 chambres,3 sdbs,https://www.avito.ma/fr/autre_secteur/appartements/Appartement_%C3%A0_vendre_145_m%C2%B2_%C3%A0_la_marina_casablanca_56472283.htm
Bel Appartement à vendre de 90 m² à Tanja Balia,1260000,"Appartements dans Tanger, Tanja Balia",bel appartement à vendre de 90 m² à tanja balia,2 chambres,2 sdbs,https://www.avito.ma/fr/tanja_balia/appartements/Bel_Appartement_%C3%A0_vendre_de_90_m%C2%B2_%C3%A0_Tanja_Balia_55775583.htm
Appartement à vendre à Temara Oulad Mtaa,850000,"Appartements dans Temara, Riad Oulad Mtaa",,2 chambres,2 sdbs,https://www.avito.ma/fr/riad_oulad_mtaa/appartements/Appartement_%C3%A0_vendre_%C3%A0_Temara_Oulad_Mtaa_57489000.htm
Appartement à vendre 115 m² à Temara,1690000,"Appartements dans Temara, Oued Eddahab",115 m²,3 chambres,1 sdb,https://www.avito.ma/fr/oued_eddahab/appartements/Appartement_%C3%A0_vendre_115_m%C2%B2_%C3%A0_Temara_57774592.htm
Appartement à vendre 80 m² à Kénitra,550000,"Appartements dans Kénitra, Seyad",80 m²,2 chambres,2 sdbs,https://www.avito.ma/fr/seyad/appartements/Appartement_%C3%A0_vendre_80_m%C2%B2_%C3%A0_K%C3%A9nitra_57737998.htm
Appartement à vendre 70 m² - Hay Chrifa,900000,"Appartements dans Casablanca, Hay Chrifa",70 m²,2 chambres,1 sdb,https://www.avito.ma/fr/hay_chrifa/appartements/Appartement_%C3%A0_vendre_70_m%C2%B2___Hay_Chrifa_57736287.htm
Appartement à vendre de 120 m² à Tanja Balia,1680000,"Appartements dans Tanger, Tanja Balia",appartement à vendre de 120 m² à tanja balia,3 chambres,2 sdbs,https://www.avito.ma/fr/tanja_balia/appartements/Appartement_%C3%A0_vendre_de_120_m%C2%B2_%C3%A0_Tanja_Balia_55801320.htm
Appartement à vendre 119 m² sur 2mars,1606500,"Appartements dans Casablanca, 2 Mars",119 m²,3 chambres,1 sdb,https://www.avito.ma/fr/2_mars/appartements/Appartement_%C3%A0_vendre_119_m%C2%B2_sur_2mars_57556591.htm
Joli Appartement à vendre 117m² Hay salam,,"Appartements dans Agadir, Hay Salam",joli appartement à vendre 117m² hay salam,3 chambres,2 sdbs,https://www.avito.ma/fr/hay_salam/appartements/Joli_Appartement_%C3%A0_vendre_117m%C2%B2_Hay_salam_57634595.htm
Duplex familial - 269 m² - Ville verte,4000000,"Appartements dans Bouskoura, Ville verte",184 m²,3 chambres,3 sdbs,https://www.avito.ma/fr/ville_verte/appartements/Duplex_familial___269_m%C2%B2___Ville_verte_57176187.htm
Studio Rt Casablanca – Projet Hermes 25,760000,"Appartements dans Marrakech, Route de Casablanca",,1 chambre,1 sdb,https://www.avito.ma/fr/route_de_casablanca/appartements/Studio_Rt_Casablanca___Projet_Hermes_25_57224150.htm
À vendre – Appartement 84 m² dans la résidence فن البيت العتيق – Tanger,,"Appartements dans Tanger, Hay Hassani",84 m²,2 chambres,2 sdbs,https://www.avito.ma/fr/hay_hassani/appartements/%C3%80_vendre___Appartement_84_m%C2%B2_dans_la_r%C3%A9sidence_%D9%81%D9%86_%D8%A7%D9%84%D8%A8%D9%8A%D8%AA_%D8%A7%D9%84%D8%B9%D8%AA%D9%8A%D9%82___Tanger_57313740.htm
Appartement d’Exception au Dernier Étage,4500000,"Appartements dans Casablanca, Racine",236 m²,4 chambres,2 sdbs,https://www.avito.ma/fr/racine/appartements/Appartement_d_Exception_au_Dernier_%C3%89tage_56688438.htm
Appartement Calme et Paisible à Yassmine Bouskoura,,"Appartements dans Bouskoura, Bouskoura centre",51 m²,2 chambres,2 sdbs,https://www.avito.ma/fr/bouskoura_centre/appartements/Appartement_Calme_et_Paisible_%C3%A0_Yassmine_Bouskoura_57606481.htm
👉 Appartement 64m² à vendre à Azouzia 2 chambres et salon,450000,"Appartements dans Marrakech, Azzouzia",64 m²,2 chambres,1 sdb,https://www.avito.ma/fr/azzouzia/appartements/___Appartement_64m%C2%B2_%C3%A0_vendre_%C3%A0_Azouzia_2_chambres_et_salon_57838796.htm
Appartement à vendre Riad Oulad Mtaa Temara,2700000,"Appartements dans Rabat, Autre secteur",,3 chambres,,https://www.avito.ma/fr/autre_secteur/appartements/Appartement_%C3%A0_vendre_Riad_Oulad_Mtaa_Temara_57838786.htm
Appartement à vendre à Fès,,"Appartements dans Fès, Route Ain Chkaf",77 m²,2 chambres,1 sdb,https://www.avito.ma/fr/route_ain_chkaf/appartements/Appartement_%C3%A0_vendre_%C3%A0_F%C3%A8s_57765514.htm
2 Appartements moyen standing à vendre – Benguerir,520000,"Appartements dans Ben Guerir, Toute la ville",92 m²,2 chambres,2 sdbs,https://www.avito.ma/fr/ben_guerir/appartements/2_Appartements_moyen_standing_%C3%A0_vendre___Benguerir_56548870.htm
Appartement à vendre 48 m² à Marrakech,1212500,"Appartements dans Marrakech, Guéliz",48 m²,1 chambre,0 sdb,https://www.avito.ma/fr/gu%C3%A9liz/appartements/Appartement_%C3%A0_vendre_48_m%C2%B2_%C3%A0_Marrakech_57656650.htm
Appartement de 50m² à Vendre à Tanger,380000,"Appartements dans Tanger, Aouama Gharbia",50 m²,2 chambres,1 sdb,https://www.avito.ma/fr/aouama_gharbia/appartements/Appartement_de_50m%C2%B2_%C3%A0_Vendre_%C3%A0_Tanger_53397026.htm
Appartements neufs à vendre à Guéliz,18000,"Appartements dans Marrakech, Guéliz",61 m²,2 chambres,1 sdb,https://www.avito.ma/fr/gu%C3%A9liz/appartements/Appartements_neufs_%C3%A0_vendre_%C3%A0_Gu%C3%A9liz_57818665.htm
Appartement 117 m à Prestigia,,"Appartements dans Rabat, Hay Riad",117 m²,2 chambres,2 sdbs,https://www.avito.ma/fr/hay_riad/appartements/Appartement_117_m_%C3%A0_Prestigia_57838766.htm
Studio haut standing meublé à vendre – Mehdia,760000,"Appartements dans Kénitra, Autre secteur",56 m²,1 chambre,1 sdb,https://www.avito.ma/fr/autre_secteur/appartements/Studio_haut_standing_meubl%C3%A9_%C3%A0_vendre___Mehdia_57320245.htm
