title,price,location,surface,rooms,baths,link
Deux appartements à vendre derrière le complexe Al Hosni - par cession,560000,"Appartements dans Tanger, Hay Hassani",60 m²,2 chambres,1 sdb,https://www.avito.ma/fr/hay_hassani/appartements/Deux_appartements_%C3%A0_vendre_derri%C3%A8re_le_complexe_Al_Hosni___par_cession_57635187.htm
Duplex RDC 99m2 Madame Plaza près de Marjane,1100000,"Appartements dans Marrakech, Av Abdelkrim El Khattabi",,2 chambres,2 sdbs,https://www.avito.ma/fr/av_abdelkrim_el_khattabi/appartements/Duplex_RDC_99m2_Madame_Plaza_pr%C3%A8s_de_Marjane_57681378.htm
Charmant appartement à vendre - Résidence OUBAHA,1150000,"Appartements dans El Mansouria, Toute la ville",100 m²,3 chambres,2 sdbs,https://www.avito.ma/fr/el_mansouria/appartements/Charmant_appartement_%C3%A0_vendre___R%C3%A9sidence_OUBAHA_57256920.htm
Bonne affaire sur la corniche,850000,"Appartements dans Tanger, Centre ville",64 m²,2 chambres,1 sdb,https://www.avito.ma/fr/centre_ville/appartements/Bonne_affaire_sur_la_corniche_57817834.htm
Appartement 76m Neuf A Maarif Ex,1460000,"Appartements dans Casablanca, Maarif",76 m²,2 chambres,2 sdbs,https://www.avito.ma/fr/maarif/appartements/Appartement_76m_Neuf_A_Maarif_Ex_57712316.htm
Bel appartement en rez de jardin sur résidence,3300000,"Appartements dans Marrakech, Agdal",100 m²,3 chambres,2 sdbs,https://www.avito.ma/fr/agdal/appartements/Bel_appartement_en_rez_de_jardin_sur_r%C3%A9sidence_57536307.htm
Appartement à vendre 102 m² à Agadir,2750000,"Appartements dans Agadir, Founty",appartement à vendre 102 m² à agadir,2 chambres,3 sdbs,https://www.avito.ma/fr/founty/appartements/Appartement_%C3%A0_vendre_102_m%C2%B2_%C3%A0_Agadir_57094364.htm
Appartement à vendre 95 m² à Marrakech,1350000,"Appartements dans Marrakech, Route de Safi",95 m²,2 chambres,1 sdb,https://www.avito.ma/fr/route_de_safi/appartements/Appartement_%C3%A0_vendre_95_m%C2%B2_%C3%A0_Marrakech_57746811.htm
Appartement neuf et équipé de haute qualité,525000,"Appartements dans Meknès, Autre secteur",110 m²,3 chambres,1 sdb,https://www.avito.ma/fr/autre_secteur/appartements/Appartement_neuf_et_%C3%A9quip%C3%A9_de_haute_qualit%C3%A9_57780125.htm
Superbe appartement familial au cœur Racine,4216000,"Appartements dans Casablanca, Racine",284 m²,3 chambres,3 sdbs,https://www.avito.ma/fr/racine/appartements/Superbe_appartement_familial_au_c_ur_Racine_57790576.htm
Appartement à vendre à Ouad law,500000,"Appartements dans Tétouan, Autre secteur",,2 chambres,1 sdb,https://www.avito.ma/fr/autre_secteur/appartements/Appartement_%C3%A0_vendre_%C3%A0_Ouad_law_57745638.htm
Appartement à vendre Hivernage marrakech,14500,"Appartements dans Marrakech, Hivernage",85 m²,2 chambres,2 sdbs,https://www.avito.ma/fr/hivernage/appartements/Appartement_%C3%A0_vendre_Hivernage_marrakech_57224477.htm
Appartement à vendre 61 m² à Marrakech,1530000,"Appartements dans Marrakech, Guéliz",61 m²,1 chambre,1 sdb,https://www.avito.ma/fr/gu%C3%A9liz/appartements/Appartement_%C3%A0_vendre_61_m%C2%B2_%C3%A0_Marrakech_57656693.htm
Grand Appartement Plein Centre de Kénitra 154 m²,1360000,"Appartements dans Kénitra, Centre",154 m²,3 chambres,2 sdbs,https://www.avito.ma/fr/centre/appartements/Grand_Appartement_Plein_Centre_de_K%C3%A9nitra_154_m%C2%B2_57587635.htm
Appartement à vendre 65 m² à Martil,480000,"Appartements dans Martil, Toute la ville",appartement à vendre 65 m² à martil,2 chambres,1 sdb,https://www.avito.ma/fr/martil/appartements/Appartement_%C3%A0_vendre_65_m%C2%B2_%C3%A0_Martil_55449361.htm
CMN-MA-1866 - Appartement à vendre à Les princesses,1330000,"Appartements dans Casablanca, Les Princesses",106 m²,2 chambres,1 sdb,https://www.avito.ma/fr/les_princesses/appartements/CMN_MA_1866___Appartement_%C3%A0_vendre_%C3%A0_Les_princesses_55872150.htm
Appartement Haut standing à vendre / piscine,1900000,"Appartements dans Marrakech, Ain Mezouar",100 m²,3 chambres,2 sdbs,https://www.avito.ma/fr/ain_mezouar/appartements/Appartement_Haut_standing_%C3%A0_vendre___piscine_57824629.htm
Bon plan Appartement à vendre 64 m² à Mohammedia,450000,"Appartements dans Mohammedia, Autre secteur",bon plan appartement à vendre 64 m² à mohammedia,2 chambres,0 sdb,https://www.avito.ma/fr/autre_secteur/appartements/Bon_plan_Appartement_%C3%A0_vendre_64_m%C2%B2_%C3%A0_Mohammedia_57839057.htm
Bel appartement,395000,"Appartements dans Saidia, Toute la ville",76 m²,3 chambres,2 sdbs,https://www.avito.ma/fr/saidia/appartements/Bel_appartement_57263311.htm
Appartement à vendre 186 m² à Tanger,7200000,"Appartements dans Tanger, Malabata",186 m²,4 chambres,2 sdbs,https://www.avito.ma/fr/malabata/appartements/Appartement_%C3%A0_vendre_186_m%C2%B2_%C3%A0_Tanger_57325686.htm
Appartement neuf à Sala El Jadida,1099800,"Appartements dans Salé, Sala El Jadida",94 m²,2 chambres,2 sdbs,https://www.avito.ma/fr/sala_el_jadida/appartements/Appartement_neuf_%C3%A0_Sala_El_Jadida_53271053.htm
Très bel Appartement 124m² à vendre - Gauthier 4ème étage,2750000,"Appartements dans Casablanca, Maarif",très bel appartement 124m² à vendre - gauthier 4ème étage,2 chambres,2 sdbs,https://www.avito.ma/fr/maarif/appartements/Tr%C3%A8s_bel_Appartement_124m%C2%B2_%C3%A0_vendre___Gauthier_4%C3%A8me_%C3%A9tage_57839033.htm
Appartement à vendre 110 m² à Bouznika,1670000,"Appartements dans Bouznika, Autre secteur",118 m²,3 chambres,2 sdbs,https://www.avito.ma/fr/autre_secteur/appartements/Appartement_%C3%A0_vendre_110_m%C2%B2_%C3%A0_Bouznika_57256859.htm
Appartement 87 m² en vente près clinique kawtar,650000,"Appartements dans Fès, Ain Amiyer",87 m²,3 chambres,2 sdbs,https://www.avito.ma/fr/ain_amiyer/appartements/Appartement_87_m%C2%B2_en_vente_pr%C3%A8s_clinique_kawtar_57151475.htm
"Studio neuf à vendre – Bourgogne, Casablanca",1270000,"Appartements dans Casablanca, Bourgogne",66 m²,1 chambre,1 sdb,https://www.avito.ma/fr/bourgogne/appartements/Studio_neuf_%C3%A0_vendre___Bourgogne__Casablanca_57765581.htm
Appartements à vendre,2800000,"Appartements dans Agadir, Haut-Founty",150 m²,3 chambres,3 sdbs,https://www.avito.ma/fr/haut_founty/appartements/Appartements_%C3%A0_vendre_57804087.htm
Appartement à vendre 150 m² à Casablanca,3400000,"Appartements dans Casablanca, Oasis",163 m²,3 chambres,2 sdbs,https://www.avito.ma/fr/oasis/appartements/Appartement_%C3%A0_vendre_150_m%C2%B2_%C3%A0_Casablanca_57723071.htm
CMN-AC-2017 - Appartement à vendre à Californie,1690000,"Appartements dans Casablanca, Californie",144 m²,2 chambres,2 sdbs,https://www.avito.ma/fr/californie/appartements/CMN_AC_2017___Appartement_%C3%A0_vendre_%C3%A0_Californie_57245074.htm
Appartement à vendre à Mesnana Golf Tanger,650000,"Appartements dans Tanger, Mesnana",,2 chambres,1 sdb,https://www.avito.ma/fr/mesnana/appartements/Appartement_%C3%A0_vendre_%C3%A0_Mesnana_Golf_Tanger_57838970.htm
Studio 42m Neuf Maarif Proche BD Biranzaran,980000,"Appartements dans Casablanca, Maarif",42 m²,1 chambre,1 sdb,https://www.avito.ma/fr/maarif/appartements/Studio_42m_Neuf_Maarif_Proche_BD_Biranzaran_57785117.htm
Appartement à vendre 176 m² à Martil,,"Appartements dans Martil, Toute la ville",176 m²,3 chambres,2 sdbs,https://www.avito.ma/fr/martil/appartements/Appartement_%C3%A0_vendre_176_m%C2%B2_%C3%A0_Martil_57838951.htm
Appartement 147 M² à Mohammedia,1650000,"Appartements dans Mohammedia, Autre secteur",14 m²,2 chambres,1 sdb,https://www.avito.ma/fr/autre_secteur/appartements/Appartement_147_M%C2%B2_%C3%A0_Mohammedia_57761127.htm
Appartement à vendre à Oulfa,700000,"Appartements dans Casablanca, Oulfa",73 m²,2 chambres,2 sdbs,https://www.avito.ma/fr/oulfa/appartements/Appartement_%C3%A0_vendre_%C3%A0_Oulfa_57712644.htm
Studio à vendre 51m² à Gauthier,1000000,"Appartements dans Casablanca, Gauthier",studio à vendre 51m² à gauthier,1 chambre,1 sdb,https://www.avito.ma/fr/gauthier/appartements/Studio_%C3%A0_vendre_51m%C2%B2_%C3%A0_Gauthier_57061039.htm
Appartement de 95 m² de Luxe Neuf à Vendre,,"Appartements dans Tanger, Du Golf",appartement de 95 m² de luxe neuf à vendre,3 chambres,3 sdbs,https://www.avito.ma/fr/du_golf/appartements/Appartement_de_95_m%C2%B2_de_Luxe_Neuf_%C3%A0_Vendre_56767719.htm
Offre à ne pas rater,960000,"Appartements dans Agadir, El Houda",,2 chambres,2 sdbs,https://www.avito.ma/fr/el_houda/appartements/Offre_%C3%A0_ne_pas_rater_57798454.htm
Appartements à vendre,1400000,"Appartements dans Agadir, Haut-Founty",70 m²,2 chambres,2 sdbs,https://www.avito.ma/fr/haut_founty/appartements/Appartements_%C3%A0_vendre_57803975.htm
Appartement à vendre 52 m² à Marrakech,1200000,"Appartements dans Marrakech, Guéliz",52 m²,1 chambre,1 sdb,https://www.avito.ma/fr/gu%C3%A9liz/appartements/Appartement_%C3%A0_vendre_52_m%C2%B2_%C3%A0_Marrakech_56035043.htm
Appartements de luxe à Bouremana,870000,"Appartements dans Fès, Agdal",120 m²,3 chambres,,https://www.avito.ma/fr/agdal/appartements/Appartements_de_luxe_%C3%A0_Bouremana_48808599.htm
Appartement à vendre à Marina Golf Asilah,950000,"Appartements dans Asilah, Toute la ville",150 m²,2 chambres,1 sdb,https://www.avito.ma/fr/asilah/appartements/Appartement_%C3%A0_vendre_%C3%A0_Marina_Golf_Asilah_57769496.htm
Appartement à vendre 133 m² sur 2 mars,1700000,"Appartements dans Casablanca, 2 Mars",133 m²,3 chambres,2 sdbs,https://www.avito.ma/fr/2_mars/appartements/Appartement_%C3%A0_vendre_133_m%C2%B2_sur_2_mars_57696869.htm
Beau studio à Madame plaza entre Mc Do et Marjane,750000,"Appartements dans Marrakech, Av Abdelkrim El Khattabi",,1 chambre,1 sdb,https://www.avito.ma/fr/av_abdelkrim_el_khattabi/appartements/Beau_studio_%C3%A0_Madame_plaza_entre_Mc_Do_et_Marjane_57576826.htm
Appartement à vendre 78 m² à Tanger,1205099,"Appartements dans Tanger, Ahlane",appartement à vendre 78 m² à tanger,3 chambres,2 sdbs,https://www.avito.ma/fr/ahlane/appartements/Appartement_%C3%A0_vendre_78_m%C2%B2_%C3%A0_Tanger_57262591.htm
Appartement à vendre 72 m² à Rachédia 2 Fes,450000,"Appartements dans Fès, Autre secteur",72 m²,2 chambres,1 sdb,https://www.avito.ma/fr/autre_secteur/appartements/Appartement_%C3%A0_vendre_72_m%C2%B2_%C3%A0_Rach%C3%A9dia_2_Fes_57616573.htm
Appartement à vendre à Berrechid El Qabbah,340000,"Appartements dans Berrechid, Toute la ville",70 m²,2 chambres,1 sdb,https://www.avito.ma/fr/berrechid/appartements/Appartement_%C3%A0_vendre_%C3%A0_Berrechid_El_Qabbah_57707198.htm
Appartement 112 m² près café Mégad’Or à Fès,650000,"Appartements dans Fès, Route Ain Chkaf",112 m²,3 chambres,2 sdbs,https://www.avito.ma/fr/route_ain_chkaf/appartements/Appartement_112_m%C2%B2_pr%C3%A8s_caf%C3%A9_M%C3%A9gad_Or_%C3%A0_F%C3%A8s_57370688.htm
Appartement à vendre 77 m² à Salé Said Hajii,,"Appartements dans Salé, Said Hajji",77 m²,2 chambres,1 sdb,https://www.avito.ma/fr/said_hajji/appartements/Appartement_%C3%A0_vendre_77_m%C2%B2_%C3%A0_Sal%C3%A9_Said_Hajii_57223332.htm
Appartement à vendre 50 m² à Rabat-Agdal,1400000,"Appartements dans Rabat, Agdal",appartement à vendre 50 m² à rabat-agdal,1 chambre,2 sdbs,https://www.avito.ma/fr/agdal/appartements/Appartement_%C3%A0_vendre_50_m%C2%B2_%C3%A0_Rabat_Agdal_57838926.htm
Studio à vendre 52 m² à Californie,1100000,"Appartements dans Casablanca, Californie",58 m²,1 chambre,1 sdb,https://www.avito.ma/fr/californie/appartements/Studio_%C3%A0_vendre_52_m%C2%B2_%C3%A0_Californie_56564882.htm
Magnifique Appartement à vendre 77 m² à Marrakech,1078000,"Appartements dans Marrakech, Hay Izdihar",77 m²,2 chambres,2 sdbs,https://www.avito.ma/fr/hay_izdihar/appartements/Magnifique_Appartement_%C3%A0_vendre_77_m%C2%B2_%C3%A0_Marrakech_57790009.htm
Penthouse neuf de haut standing à El Menzah (Km17),,"Appartements dans El Menzeh, Toute la ville",242 m²,5 chambres,6 sdbs,https://www.avito.ma/fr/el_menzeh/appartements/Penthouse_neuf_de_haut_standing_%C3%A0_El_Menzah__Km17__57711852.htm
Appartement à vendre – Marrakech,600000,"Appartements dans Marrakech, Hay Charaf",59 m²,2 chambres,1 sdb,https://www.avito.ma/fr/hay_charaf/appartements/Appartement_%C3%A0_vendre___Marrakech_57775121.htm
Appartement à vendre 45 m² à Marrakech,880000,"Appartements dans Marrakech, Victor Hugo",appartement à vendre 45 m² à marrakech,1 chambre,1 sdb,https://www.avito.ma/fr/victor_hugo/appartements/Appartement_%C3%A0_vendre_45_m%C2%B2_%C3%A0_Marrakech_57118825.htm
Appartement à vendre à saidia proche de la plage,,"Appartements dans Saidia, Toute la ville",,2 chambres,1 sdb,https://www.avito.ma/fr/saidia/appartements/Appartement_%C3%A0_vendre_%C3%A0_saidia_proche_de_la_plage_28498136.htm
Appartements à vendre 64 m² à Ben Guerir,300000,"Appartements dans Ben Guerir, Toute la ville",64 m²,3 chambres,2 sdbs,https://www.avito.ma/fr/ben_guerir/appartements/Appartements_%C3%A0_vendre_64_m%C2%B2_%C3%A0_Ben_Guerir_57735424.htm
Appartement à vendre 80 m² à Kénitra,490000,"Appartements dans Kénitra, Seyad",80 m²,2 chambres,1 sdb,https://www.avito.ma/fr/seyad/appartements/Appartement_%C3%A0_vendre_80_m%C2%B2_%C3%A0_K%C3%A9nitra_57727010.htm
CMN-SI-1881 - Appartement à vendre à Bourgogne Est,1800000,"Appartements dans Casablanca, Bourgogne",103 m²,3 chambres,2 sdbs,https://www.avito.ma/fr/bourgogne/appartements/CMN_SI_1881___Appartement_%C3%A0_vendre_%C3%A0_Bourgogne_Est_57341638.htm
Appartement à vendre 170 m² à CFC,4200000,"Appartements dans Casablanca, Casablanca Finance City",170 m²,3 chambres,3 sdbs,https://www.avito.ma/fr/casablanca_finance_city/appartements/Appartement_%C3%A0_vendre_170_m%C2%B2_%C3%A0_CFC_57775845.htm
BEN-MA-1118 - Appartement à vendre à Mansouria-B...,1200000,"Appartements dans Benslimane, Autre secteur",98 m²,2 chambres,1 sdb,https://www.avito.ma/fr/autre_secteur/appartements/BEN_MA_1118___Appartement_%C3%A0_vendre_%C3%A0_Mansouria_B____57276565.htm
Appartement à vendre à 3 min du stade de Tanger,970000,"Appartements dans Tanger, Zemmouri",75 m²,2 chambres,1 sdb,https://www.avito.ma/fr/zemmouri/appartements/Appartement_%C3%A0_vendre_%C3%A0_3_min_du_stade_de_Tanger_57704607.htm
"Appartements finis à vendre, Jardins de Zenata, route de Rabat",,"Appartements dans Tanger, Centre",,2 chambres,1 sdb,https://www.avito.ma/fr/centre/appartements/Appartements_finis_%C3%A0_vendre__Jardins_de_Zenata__route_de_Rabat_56506069.htm
Appartement Maamora Centre Ville Kénitra,1490000,"Appartements dans Kénitra, Maamora",,2 chambres,2 sdbs,https://www.avito.ma/fr/maamora/appartements/Appartement_Maamora_Centre_Ville_K%C3%A9nitra_57261794.htm
Appartement à vendre à Ain Sebaa,1070000,"Appartements dans Casablanca, Ain Sebaa",,2 chambres,1 sdb,https://www.avito.ma/fr/ain_sebaa/appartements/Appartement_%C3%A0_vendre_%C3%A0_Ain_Sebaa_57429036.htm
Appartement à vendre 128 m² à Bouskoura,1300000,"Appartements dans Bouskoura, Victoria",140 m²,3 chambres,2 sdbs,https://www.avito.ma/fr/victoria/appartements/Appartement_%C3%A0_vendre_128_m%C2%B2_%C3%A0_Bouskoura_57814586.htm
Appartement neuf à vendre Ain Sebaa,1070000,"Appartements dans Casablanca, Ain Sebaa",81 m²,2 chambres,2 sdbs,https://www.avito.ma/fr/ain_sebaa/appartements/Appartement_neuf_%C3%A0_vendre_Ain_Sebaa_57342001.htm
Appartement à vendre à Bouznika,,"Appartements dans Bouznika, Autre secteur",84 m²,3 chambres,2 sdbs,https://www.avito.ma/fr/autre_secteur/appartements/Appartement_%C3%A0_vendre_%C3%A0_Bouznika_56685321.htm
Appartement triplex à vendre 128m² à HM Casablanca,850000,"Appartements dans Casablanca, Hay Mohammadi",128 m²,4 chambres,2 sdbs,https://www.avito.ma/fr/hay_mohammadi/appartements/Appartement_triplex_%C3%A0_vendre_128m%C2%B2_%C3%A0_HM_Casablanca_57029102.htm
"Bel appartement à vendre Bourgogne, My Youssef",1280000,"Appartements dans Casablanca, Bourgogne",93 m²,2 chambres,2 sdbs,https://www.avito.ma/fr/bourgogne/appartements/Bel_appartement_%C3%A0_vendre_Bourgogne__My_Youssef_57793674.htm
"Appartement à El Jadida, quartier El Milha, sur la rue",550000,"Appartements dans El Jadida, Mouilha",88 m²,2 chambres,1 sdb,https://www.avito.ma/fr/mouilha/appartements/Appartement_%C3%A0_El_Jadida__quartier_El_Milha__sur_la_rue_57335734.htm
Appartement 82 m2 résidence Ricoflores piscine,860000,"Appartements dans Mohammedia, Centre Ville",82 m²,2 chambres,1 sdb,https://www.avito.ma/fr/centre_ville/appartements/Appartement_82_m2_r%C3%A9sidence_Ricoflores_piscine_57355316.htm
"Duplex avec garage privé Sidi Maarouf, Essaada",1650000,"Appartements dans Casablanca, Sidi Maarouf",159 m²,2 chambres,3 sdbs,https://www.avito.ma/fr/sidi_maarouf/appartements/Duplex_avec_garage_priv%C3%A9_Sidi_Maarouf__Essaada_57819495.htm
Des apt neuf a vendre 85 m2 tanger,1147500,"Appartements dans Tanger, Marjane",96 m²,2 chambres,2 sdbs,https://www.avito.ma/fr/marjane/appartements/Des_apt_neuf_a_vendre_85_m2_tanger_57284651.htm
Appartement à vendre 165 m² La perle D'Agadir,2272500,"Appartements dans Agadir, Talborjt",165 m²,4 chambres,1 sdb,https://www.avito.ma/fr/talborjt/appartements/Appartement_%C3%A0_vendre_165_m%C2%B2_La_perle_D_Agadir_56449554.htm
Appartement à vendre 94 m² sur bourgogne,1750000,"Appartements dans Casablanca, Bourgogne",94 m²,2 chambres,0 sdb,https://www.avito.ma/fr/bourgogne/appartements/Appartement_%C3%A0_vendre_94_m%C2%B2_sur_bourgogne_57729273.htm
Appartement à vendre 70 m² à Kénitra,360000,"Appartements dans Kénitra, Bir Rami",70 m²,2 chambres,2 sdbs,https://www.avito.ma/fr/bir_rami/appartements/Appartement_%C3%A0_vendre_70_m%C2%B2_%C3%A0_K%C3%A9nitra_57722547.htm
Appartement à vendre 120 m² à Tanger,2500000,"Appartements dans Tanger, Autre secteur",165 m²,2 chambres,2 sdbs,https://www.avito.ma/fr/autre_secteur/appartements/Appartement_%C3%A0_vendre_120_m%C2%B2_%C3%A0_Tanger_57778013.htm
Appartement à vendre 89 m² à Tanger malabata,2136000,"Appartements dans Tanger, Malabata",89 m²,2 chambres,1 sdb,https://www.avito.ma/fr/malabata/appartements/Appartement_%C3%A0_vendre_89_m%C2%B2_%C3%A0_Tanger_malabata_57316793.htm
Appartement à vendre à Meknès,,"Appartements dans Meknès, Autre secteur",97 m²,3 chambres,2 sdbs,https://www.avito.ma/fr/autre_secteur/appartements/Appartement_%C3%A0_vendre_%C3%A0_Mekn%C3%A8s_56553069.htm
À vendre Superbe appartement 3 ch-Jnane Californie,1900000,"Appartements dans Casablanca, Californie",119 m²,3 chambres,2 sdbs,https://www.avito.ma/fr/californie/appartements/%C3%80_vendre_Superbe_appartement_3_ch_Jnane_Californie_57815555.htm
Appartement à vendre 83 m² à guéliz Marrakech,1650000,"Appartements dans Marrakech, Guéliz",80 m²,2 chambres,1 sdb,https://www.avito.ma/fr/gu%C3%A9liz/appartements/Appartement_%C3%A0_vendre_83_m%C2%B2_%C3%A0_gu%C3%A9liz_Marrakech_55798412.htm
appartement a vendre meuble,600000,"Appartements dans Marrakech, Route de Casablanca",52 m²,2 chambres,1 sdb,https://www.avito.ma/fr/route_de_casablanca/appartements/appartement_a_vendre_meuble_57699894.htm
Bel appart RDC SUR centre ville,650000,"Appartements dans Mohammedia, Centre Ville",80 m²,2 chambres,1 sdb,https://www.avito.ma/fr/centre_ville/appartements/Bel_appart_RDC_SUR_centre_ville_55947144.htm
Appartement Valencia Beach Mansouria,840000,"Appartements dans Mohammedia, Corniche",89 m²,2 chambres,1 sdb,https://www.avito.ma/fr/corniche/appartements/Appartement_Valencia_Beach_Mansouria_57224794.htm
Appartement 86m² à vendre – Al Azdihar Marrakech,1300000,"Appartements dans Marrakech, Hay Izdihar",86 m²,2 chambres,2 sdbs,https://www.avito.ma/fr/hay_izdihar/appartements/Appartement_86m%C2%B2_%C3%A0_vendre___Al_Azdihar_Marrakech_57834491.htm
Appartement 126m² 4ème étg. terrasse à Maârif,1450000,"Appartements dans Casablanca, Val Fleuri",126 m²,2 chambres,2 sdbs,https://www.avito.ma/fr/val_fleuri/appartements/Appartement_126m%C2%B2_4%C3%A8me_%C3%A9tg__terrasse_%C3%A0_Ma%C3%A2rif_56872194.htm
Appartement à vendre à Cabo Negro,1400000,"Appartements dans Cabo Negro, Toute la ville",75 m²,1 chambre,1 sdb,https://www.avito.ma/fr/cabo_negro/appartements/Appartement_%C3%A0_vendre_%C3%A0_Cabo_Negro_57745510.htm
Appartement économique à vendre,190000,"Appartements dans Salé, Toute la ville",55 m²,2 chambres,1 sdb,https://www.avito.ma/fr/sal%C3%A9/appartements/Appartement_%C3%A9conomique_%C3%A0_vendre_54265071.htm
Appartement 3 chambres à 2min de Casanearshore,780000,"Appartements dans Casablanca, Sidi Maarouf",70 m²,3 chambres,1 sdb,https://www.avito.ma/fr/sidi_maarouf/appartements/Appartement_3_chambres_%C3%A0_2min_de_Casanearshore_57828086.htm
Appartements à vendre – Immeuble 3 étages,1000000,"Appartements dans Tanger, Ahlane",80 m²,3 chambres,1 sdb,https://www.avito.ma/fr/ahlane/appartements/Appartements_%C3%A0_vendre___Immeuble_3_%C3%A9tages_57442342.htm
Appartement enregistré à vendre,6200000,"Appartements dans Tétouan, Al Azhar",126 m²,3 chambres,1 sdb,https://www.avito.ma/fr/al_azhar/appartements/Appartement_enregistr%C3%A9_%C3%A0_vendre_57838894.htm
Appartement neuf 98m² à vendre à salé Tabriquet,1220000,"Appartements dans Salé, Tabriquet",appartement neuf 98m² à vendre à salé tabriquet,3 chambres,2 sdbs,https://www.avito.ma/fr/tabriquet/appartements/Appartement_neuf_98m%C2%B2_%C3%A0_vendre_%C3%A0_sal%C3%A9_Tabriquet_45814550.htm
STUDIO MAGNIFIQUE À SAISIR,1350000,"Appartements dans Casablanca, Riviera",48 m²,1 chambre,1 sdb,https://www.avito.ma/fr/riviera/appartements/STUDIO_MAGNIFIQUE_%C3%80_SAISIR_56341164.htm
appartement a vendre meuble,600000,"Appartements dans Marrakech, Route de Casablanca",52 m²,2 chambres,1 sdb,https://www.avito.ma/fr/route_de_casablanca/appartements/appartement_a_vendre_meuble_57699894.htm
Bel appart RDC SUR centre ville,650000,"Appartements dans Mohammedia, Centre Ville",80 m²,2 chambres,1 sdb,https://www.avito.ma/fr/centre_ville/appartements/Bel_appart_RDC_SUR_centre_ville_55947144.htm
Appartement Valencia Beach Mansouria,840000,"Appartements dans Mohammedia, Corniche",89 m²,2 chambres,1 sdb,https://www.avito.ma/fr/corniche/appartements/Appartement_Valencia_Beach_Mansouria_57224794.htm
Appartement 86m² à vendre – Al Azdihar Marrakech,1300000,"Appartements dans Marrakech, Hay Izdihar",86 m²,2 chambres,2 sdbs,https://www.avito.ma/fr/hay_izdihar/appartements/Appartement_86m%C2%B2_%C3%A0_vendre___Al_Azdihar_Marrakech_57834491.htm
Appartement 126m² 4ème étg. terrasse à Maârif,1450000,"Appartements dans Casablanca, Val Fleuri",126 m²,2 chambres,2 sdbs,https://www.avito.ma/fr/val_fleuri/appartements/Appartement_126m%C2%B2_4%C3%A8me_%C3%A9tg__terrasse_%C3%A0_Ma%C3%A2rif_56872194.htm
Appartement à vendre à Cabo Negro,1400000,"Appartements dans Cabo Negro, Toute la ville",75 m²,1 chambre,1 sdb,https://www.avito.ma/fr/cabo_negro/appartements/Appartement_%C3%A0_vendre_%C3%A0_Cabo_Negro_57745510.htm
Appartement Neuf 84 m² à Guéliz Avec Piscine,1550000,"Appartements dans Marrakech, Guéliz",84 m²,2 chambres,2 sdbs,https://www.avito.ma/fr/gu%C3%A9liz/appartements/Appartement_Neuf_84_m%C2%B2_%C3%A0_Gu%C3%A9liz_Avec_Piscine_56259750.htm
Studio exceptionnel de 60 m² au centre Guéliz,1500000,"Appartements dans Marrakech, Guéliz",60 m²,1 chambre,1 sdb,https://www.avito.ma/fr/gu%C3%A9liz/appartements/Studio_exceptionnel_de_60_m%C2%B2_au_centre_Gu%C3%A9liz_57638403.htm
Joli appart 113m2 près de Amoud et McDonald,1300000,"Appartements dans Marrakech, Av Abdelkrim El Khattabi",113 m²,2 chambres,1 sdb,https://www.avito.ma/fr/av_abdelkrim_el_khattabi/appartements/Joli_appart_113m2_pr%C3%A8s_de_Amoud_et_McDonald_57720703.htm
Studio vue piscine à vendre 51 m² à Marrakech,1150000,"Appartements dans Marrakech, Hivernage",51 m²,1 chambre,1 sdb,https://www.avito.ma/fr/hivernage/appartements/Studio_vue_piscine_%C3%A0_vendre_51_m%C2%B2_%C3%A0_Marrakech_57774591.htm
Appartement meublé à vendre dans un quartier résidentiel à Tamassna,550000,"Appartements dans Tamesna, Toute la ville",61 m²,1 chambre,2 sdbs,https://www.avito.ma/fr/tamesna/appartements/Appartement_meubl%C3%A9_%C3%A0_vendre_dans_un_quartier_r%C3%A9sidentiel_%C3%A0_Tamassna_57140046.htm
"Appartement à vendre titré à Tanger, Al Amel",750000,"Appartements dans Tanger, Aouama Gharbia",100 m²,2 chambres,2 sdbs,https://www.avito.ma/fr/aouama_gharbia/appartements/Appartement_%C3%A0_vendre_titr%C3%A9_%C3%A0_Tanger__Al_Amel_57838851.htm
Studios Neuf 36m à 38m Quartiers Des Hôpitaux,820000,"Appartements dans Casablanca, 2 Mars",36 m²,1 chambre,1 sdb,https://www.avito.ma/fr/2_mars/appartements/Studios_Neuf_36m_%C3%A0_38m_Quartiers_Des_H%C3%B4pitaux_54451973.htm
Vente Appartement 5 pièces de 158 m2 à Casablanca,1400000,"Appartements dans Casablanca, Sidi Moumen",158 m²,3 chambres,2 sdbs,https://www.avito.ma/fr/sidi_moumen/appartements/Vente_Appartement_5_pi%C3%A8ces_de_158_m2_%C3%A0_Casablanca_57838838.htm
Penthouse avec piscine à vendre 320 m² à Tanger,7680000,"Appartements dans Tanger, Malabata",320 m²,2 chambres,1 sdb,https://www.avito.ma/fr/malabata/appartements/Penthouse_avec_piscine_%C3%A0_vendre_320_m%C2%B2_%C3%A0_Tanger_57316830.htm
Projets Appartements Haut Standing a Tanja Balia,,"Appartements dans Tanger, Tanja Balia",,2 chambres,1 sdb,https://www.avito.ma/fr/tanja_balia/appartements/Projets_Appartements_Haut_Standing_a_Tanja_Balia_57390744.htm
Appartement à vendre 94 m² à Temara Wifak,1250000,"Appartements dans Temara, Oued Eddahab",94 m²,3 chambres,1 sdb,https://www.avito.ma/fr/oued_eddahab/appartements/Appartement_%C3%A0_vendre_94_m%C2%B2_%C3%A0_Temara_Wifak_57774654.htm
Appartement 195m² à vendre à Californie Bachkou,2550000,"Appartements dans Casablanca, Californie",195 m²,3 chambres,2 sdbs,https://www.avito.ma/fr/californie/appartements/Appartement_195m%C2%B2_%C3%A0_vendre_%C3%A0_Californie_Bachkou_56762095.htm
Appartement à vendre ou à louer à Salé,,"Appartements dans Salé, Hay Chmaou",50 m²,2 chambres,2 sdbs,https://www.avito.ma/fr/hay_chmaou/appartements/Appartement_%C3%A0_vendre_ou_%C3%A0_louer_%C3%A0_Sal%C3%A9_57740103.htm
