title,price,location,surface,rooms,baths,link
Appartement à vendre 90 m rjafalah à Oujda,260000,"Appartements dans Oujda, Hay Ennasr",,2 chambres,1 sdb,https://www.avito.ma/fr/hay_ennasr/appartements/Appartement_%C3%A0_vendre_90_m_rjafalah_%C3%A0_Oujda_54393617.htm
Appartement à vendre 85 m² à Oujda,390000,"Appartements dans Oujda, Centre Ville",appartement à vendre 85 m² à oujda,2 chambres,1 sdb,https://www.avito.ma/fr/centre_ville/appartements/Appartement_%C3%A0_vendre_85_m%C2%B2_%C3%A0_Oujda_54392974.htm
Appartement à vendre 100 m² à Oujda,430000,"Appartements dans Oujda, Hay zitoune",appartement à vendre 100 m² à oujda,3 chambres,1 sdb,https://www.avito.ma/fr/hay_zitoune/appartements/Appartement_%C3%A0_vendre_100_m%C2%B2_%C3%A0_Oujda_55224106.htm
Joli Appartement 1er Etage Mhamid 7,410000,"Appartements dans Marrakech, M'Hamid",57 m²,2 chambres,1 sdb,https://www.avito.ma/fr/m_hamid/appartements/Joli_Appartement_1er_Etage_Mhamid_7_57133912.htm
Appartement d’exception front mer- Tamaris Premium,2000000,"Appartements dans Tamaris, Toute la ville",117 m²,2 chambres,1 sdb,https://www.avito.ma/fr/tamaris/appartements/Appartement_d_exception_front_mer__Tamaris_Premium_57728469.htm
Appartement à vendre 56 m² à Marrakech,1008000,"Appartements dans Marrakech, Guéliz",appartement à vendre 56 m² à marrakech,1 chambre,1 sdb,https://www.avito.ma/fr/gu%C3%A9liz/appartements/Appartement_%C3%A0_vendre_56_m%C2%B2_%C3%A0_Marrakech_57403709.htm
APPARTEMENTS HAUT STANDING À VENDRE – HAMRIA,,"Appartements dans Meknès, Hamria",208 m²,3 chambres,2 sdbs,https://www.avito.ma/fr/hamria/appartements/APPARTEMENTS_HAUT_STANDING_%C3%80_VENDRE___HAMRIA_57735856.htm
Appartement 2 fas à côté de la référence sidi yahya,,"Appartements dans Oujda, Sidi Yahya",130 m²,3 chambres,0 sdb,https://www.avito.ma/fr/sidi_yahya/appartements/Appartement_2_fas_%C3%A0_c%C3%B4t%C3%A9_de_la_r%C3%A9f%C3%A9rence_sidi_yahya_57412732.htm
"🌊 appartement vue mer en face, sans vis-à-vis",1600000,"Appartements dans Agadir, Anza",80 m²,2 chambres,2 sdbs,https://www.avito.ma/fr/anza/appartements/___appartement_vue_mer_en_face__sans_vis_%C3%A0_vis_56936072.htm
Rez-de-jardin à vendre 128 m² 20 m² jardin,2100000,"Appartements dans Rabat, Souissi",148 m²,3 chambres,2 sdbs,https://www.avito.ma/fr/souissi/appartements/Rez_de_jardin_%C3%A0_vendre_128_m%C2%B2_20_m%C2%B2_jardin_57302278.htm
Appartement à vendre Résidence Hiba Rez-de-chaussée 100 mètres,660000,"Appartements dans Tamesna, Toute la ville",,3 chambres,,https://www.avito.ma/fr/tamesna/appartements/Appartement_%C3%A0_vendre_R%C3%A9sidence_Hiba_Rez_de_chauss%C3%A9e_100_m%C3%A8tres_50631819.htm
Bel appartement à louer Ain Borja,3500,"Appartements dans Casablanca, Aïn Borja",72 m²,2 chambres,2 sdbs,https://www.avito.ma/fr/a%C3%AFn_borja/appartements/Bel_appartement_%C3%A0_louer_Ain_Borja_57839311.htm
🏠Appartement duplex 174m2 à vendre HM Casa🏠,1000000,"Appartements dans Casablanca, Hay Mohammadi",174 m²,5 chambres,2 sdbs,https://www.avito.ma/fr/hay_mohammadi/appartements/__Appartement_duplex_174m2_%C3%A0_vendre_HM_Casa___57631189.htm
Appartement à vendre 85 m² à Oujda,330000,"Appartements dans Oujda, Hay Lazaret",appartement à vendre 85 m² à oujda,2 chambres,1 sdb,https://www.avito.ma/fr/hay_lazaret/appartements/Appartement_%C3%A0_vendre_85_m%C2%B2_%C3%A0_Oujda_55095466.htm
Appartement à vendre 85 m² à Oujda,380000,"Appartements dans Oujda, Agdal",appartement à vendre 85 m² à oujda,2 chambres,1 sdb,https://www.avito.ma/fr/agdal/appartements/Appartement_%C3%A0_vendre_85_m%C2%B2_%C3%A0_Oujda_54393190.htm
Appartement 57 m² – 6e étage – Triple Tower,1500000,"Appartements dans Tanger, Malabata",57 m²,2 chambres,1 sdb,https://www.avito.ma/fr/malabata/appartements/Appartement_57_m%C2%B2___6e_%C3%A9tage___Triple_Tower_57779089.htm
Bel appartement à vendre à Bourgoune Casa,2190000,"Appartements dans Casablanca, Bourgogne",,2 chambres,2 sdbs,https://www.avito.ma/fr/bourgogne/appartements/Bel_appartement_%C3%A0_vendre_%C3%A0_Bourgoune_Casa_53059294.htm
Appartement à vendre 47 m Mdiq 4 min à pied plage,380000,"Appartements dans Mdiq, Toute la ville",50 m²,1 chambre,1 sdb,https://www.avito.ma/fr/mdiq/appartements/Appartement_%C3%A0_vendre_47_m_Mdiq_4_min_%C3%A0_pied_plage_57822212.htm
Appartement 90m² à Oujda,270000,"Appartements dans Oujda, Autre secteur",appartement 90m² à oujda,3 chambres,2 sdbs,https://www.avito.ma/fr/autre_secteur/appartements/Appartement_90m%C2%B2_%C3%A0_Oujda_55861512.htm
Appartement à vendre 106 m² à Oujda,400000,"Appartements dans Oujda, Boustane",appartement à vendre 106 m² à oujda,3 chambres,1 sdb,https://www.avito.ma/fr/boustane/appartements/Appartement_%C3%A0_vendre_106_m%C2%B2_%C3%A0_Oujda_54393198.htm
Appartement à vendre 145 m² à Oujda,570000,"Appartements dans Oujda, Hay zitoune",appartement à vendre 145 m² à oujda,4 chambres,2 sdbs,https://www.avito.ma/fr/hay_zitoune/appartements/Appartement_%C3%A0_vendre_145_m%C2%B2_%C3%A0_Oujda_54393097.htm
Appartement à vendre 80 m² à Oujda,300000,"Appartements dans Oujda, Boustane",appartement à vendre 80 m² à oujda,2 chambres,0 sdb,https://www.avito.ma/fr/boustane/appartements/Appartement_%C3%A0_vendre_80_m%C2%B2_%C3%A0_Oujda_57049632.htm
Appartement ain mezouar base militaire,520000,"Appartements dans Marrakech, Ain Mezouar",62 m²,2 chambres,1 sdb,https://www.avito.ma/fr/ain_mezouar/appartements/Appartement_ain_mezouar_base_militaire_57839264.htm
Appartement 2 ch salon balcon Martil 45m² 4ème étage,300000,"Appartements dans Martil, Toute la ville",appartement 2 ch salon balcon martil 45m² 4ème étage,2 chambres,1 sdb,https://www.avito.ma/fr/martil/appartements/Appartement_2_ch_salon_balcon_Martil_45m%C2%B2_4%C3%A8me_%C3%A9tage_55361072.htm
Appartement à vendre 120 m² à Mosquée houda,1170000,"Appartements dans Temara, Hoda",120 m²,3 chambres,2 sdbs,https://www.avito.ma/fr/hoda/appartements/Appartement_%C3%A0_vendre_120_m%C2%B2_%C3%A0_Mosqu%C3%A9e_houda_57839257.htm
Appartement 92m² 1er à Roches Noires à vendre Casa,850000,"Appartements dans Casablanca, Roches Noires",appartement 92m² 1er à roches noires à vendre casa,2 chambres,1 sdb,https://www.avito.ma/fr/roches_noires/appartements/Appartement_92m%C2%B2_1er_%C3%A0_Roches_Noires_%C3%A0_vendre_Casa_55901112.htm
Appartement 85m² à Sidi Bernoussi Casa.,740000,"Appartements dans Casablanca, Sidi Bernoussi",85 m²,3 chambres,2 sdbs,https://www.avito.ma/fr/sidi_bernoussi/appartements/Appartement_85m%C2%B2_%C3%A0_Sidi_Bernoussi_Casa__53160051.htm
Appartement à vendre Centre ville à Casablanca,1300000,"Appartements dans Casablanca, Centre Ville",,3 chambres,2 sdbs,https://www.avito.ma/fr/centre_ville/appartements/Appartement_%C3%A0_vendre_Centre_ville_%C3%A0_Casablanca_56191644.htm
Appartement Tanger Balia,620000,"Appartements dans Tanger, Tanja Balia",78 m²,2 chambres,1 sdb,https://www.avito.ma/fr/tanja_balia/appartements/Appartement_Tanger_Balia_55043962.htm
CMN-SI-1877 - Appartement à vendre à Bourgogne Est,1050000,"Appartements dans Casablanca, Bourgogne",76 m²,2 chambres,1 sdb,https://www.avito.ma/fr/bourgogne/appartements/CMN_SI_1877___Appartement_%C3%A0_vendre_%C3%A0_Bourgogne_Est_57328148.htm
Appartements à vendre à Jardins de Tanger – 60 à 70 m²,690000,"Appartements dans Tanger, Marjane",appartements à vendre à jardins de tanger – 60 à 70 m²,2 chambres,1 sdb,https://www.avito.ma/fr/marjane/appartements/Appartements_%C3%A0_vendre_%C3%A0_Jardins_de_Tanger___60_%C3%A0_70_m%C2%B2_57546863.htm
Appartement à vendre,1700000,"Appartements dans Salé, Hay Karima",,3 chambres,3 sdbs,https://www.avito.ma/fr/hay_karima/appartements/Appartement_%C3%A0_vendre_57833871.htm
Magnifique Appartement à vendre 77 m² à Marrakech,1078000,"Appartements dans Marrakech, Hay Izdihar",77 m²,2 chambres,2 sdbs,https://www.avito.ma/fr/hay_izdihar/appartements/Magnifique_Appartement_%C3%A0_vendre_77_m%C2%B2_%C3%A0_Marrakech_57790009.htm
CMN-MA-2470 - Appartement à vendre à Les Hôpitaux,1450000,"Appartements dans Casablanca, Quartier des Hôpitaux",117 m²,3 chambres,1 sdb,https://www.avito.ma/fr/quartier_des_h%C3%B4pitaux/appartements/CMN_MA_2470___Appartement_%C3%A0_vendre_%C3%A0_Les_H%C3%B4pitaux_57340348.htm
Appartement 87 m² en vente à Ayn Amir à Fès,560000,"Appartements dans Fès, Ain Amiyer",87 m²,2 chambres,1 sdb,https://www.avito.ma/fr/ain_amiyer/appartements/Appartement_87_m%C2%B2_en_vente_%C3%A0_Ayn_Amir_%C3%A0_F%C3%A8s_57642542.htm
🏢 À VENDRE – Appartement à Val Fleuri (Casa),1650000,"Appartements dans Casablanca, Val Fleuri",128 m²,3 chambres,2 sdbs,https://www.avito.ma/fr/val_fleuri/appartements/___%C3%80_VENDRE___Appartement_%C3%A0_Val_Fleuri__Casa__57753874.htm
Superbe appartement meublé à vendre en centre-ville,1180000,"Appartements dans Tanger, Centre",58 m²,2 chambres,2 sdbs,https://www.avito.ma/fr/centre/appartements/Superbe_appartement_meubl%C3%A9_%C3%A0_vendre_en_centre_ville_57030966.htm
Appartement à vendre 180 m² à Kénitra,1700000,"Appartements dans Kénitra, La Ville Haute",appartement à vendre 180 m² à kénitra,4 chambres,3 sdbs,https://www.avito.ma/fr/la_ville_haute/appartements/Appartement_%C3%A0_vendre_180_m%C2%B2_%C3%A0_K%C3%A9nitra_57774945.htm
Appartement de 3 chambres à vendre près de la station El Jadida Hrarryine,750000,"Appartements dans Tanger, Aharrarine",80 m²,3 chambres,2 sdbs,https://www.avito.ma/fr/aharrarine/appartements/Appartement_de_3_chambres_%C3%A0_vendre_pr%C3%A8s_de_la_station_El_Jadida_Hrarryine_57029815.htm
Joli appartement ensoleillé,1100000,"Appartements dans Marrakech, Guéliz",71 m²,2 chambres,2 sdbs,https://www.avito.ma/fr/gu%C3%A9liz/appartements/Joli_appartement_ensoleill%C3%A9__57523775.htm
Jolie Appartement à vendre 90m² à Casablanca,1100000,"Appartements dans Casablanca, Maarif",jolie appartement à vendre 90m² à casablanca,2 chambres,2 sdbs,https://www.avito.ma/fr/maarif/appartements/Jolie_Appartement_%C3%A0_vendre_90m%C2%B2_%C3%A0_Casablanca_55627072.htm
Appartement à vendre à Résidence tahra,570000,"Appartements dans Mohammedia, El Alia",82 m²,2 chambres,1 sdb,https://www.avito.ma/fr/el_alia/appartements/Appartement_%C3%A0_vendre_%C3%A0_R%C3%A9sidence_tahra_57814915.htm
Appartement à vendre 39 m² à Marrakech,698500,"Appartements dans Marrakech, Route d'Amezmiz",44 m²,1 chambre,1 sdb,https://www.avito.ma/fr/route_d_amezmiz/appartements/Appartement_%C3%A0_vendre_39_m%C2%B2_%C3%A0_Marrakech_57611206.htm
Appartement à vendre 130 m² à plage des nations,1850000,"Appartements dans Sidi Bouknadel, Toute la ville",130 m²,2 chambres,2 sdbs,https://www.avito.ma/fr/sidi_bouknadel/appartements/Appartement_%C3%A0_vendre_130_m%C2%B2_%C3%A0_plage_des_nations_56055121.htm
Appartement à vendre 46 m² à Marrakech,874000,"Appartements dans Marrakech, Guéliz",appartement à vendre 46 m² à marrakech,1 chambre,1 sdb,https://www.avito.ma/fr/gu%C3%A9liz/appartements/Appartement_%C3%A0_vendre_46_m%C2%B2_%C3%A0_Marrakech_57403547.htm
Bel appartement de 90 m² lotissement alliance,620000,"Appartements dans Kénitra, alliance",90 m²,2 chambres,2 sdbs,https://www.avito.ma/fr/alliance/appartements/Bel_appartement_de_90_m%C2%B2_lotissement_alliance_57398679.htm
Appartement à vendre 90 m² à lotissement alliance,640000,"Appartements dans Kénitra, alliance",90 m²,2 chambres,1 sdb,https://www.avito.ma/fr/alliance/appartements/Appartement_%C3%A0_vendre_90_m%C2%B2_%C3%A0_lotissement_alliance_57399192.htm
Joli studio 51 m² Mers Sultan,900000,"Appartements dans Casablanca, Mers Sultan",51 m²,1 chambre,0 sdb,https://www.avito.ma/fr/mers_sultan/appartements/Joli_studio_51_m%C2%B2_Mers_Sultan_57807191.htm
Studio meublé à vendre 50m² à Casablanca Maarif,1100000,"Appartements dans Casablanca, Maarif",studio meublé à vendre 50m² à casablanca maarif,1 chambre,1 sdb,https://www.avito.ma/fr/maarif/appartements/Studio_meubl%C3%A9_%C3%A0_vendre_50m%C2%B2_%C3%A0_Casablanca_Maarif_56313484.htm
Appartement Duplex à vendre 154 m² à Casablanca,1000000,"Appartements dans Casablanca, Hay Mohammadi",174 m²,4 chambres,2 sdbs,https://www.avito.ma/fr/hay_mohammadi/appartements/Appartement_Duplex_%C3%A0_vendre_154_m%C2%B2_%C3%A0_Casablanca_54390927.htm
Appartement Lux 69m,500000,"Appartements dans Had Soualem, Toute la ville",69 m²,2 chambres,2 sdbs,https://www.avito.ma/fr/had_soualem/appartements/Appartement_Lux_69m_47242927.htm
Appartements neufs à vendre près de la nouvelle station routière,,"Appartements dans Tanger, Aharrarine",90 m²,3 chambres,2 sdbs,https://www.avito.ma/fr/aharrarine/appartements/Appartements_neufs_%C3%A0_vendre_pr%C3%A8s_de_la_nouvelle_station_routi%C3%A8re_57563507.htm
Appartement à vendre 96 m² à Marrakech,1350000,"Appartements dans Marrakech, Hay Izdihar",100 m²,2 chambres,2 sdbs,https://www.avito.ma/fr/hay_izdihar/appartements/Appartement_%C3%A0_vendre_96_m%C2%B2_%C3%A0_Marrakech_57814917.htm
Appartement à vendre à Mdiq,860000,"Appartements dans Mdiq, Toute la ville",155 m²,2 chambres,2 sdbs,https://www.avito.ma/fr/mdiq/appartements/Appartement_%C3%A0_vendre_%C3%A0_Mdiq_54821467.htm
Appartement avec cour à Bouznika,710000,"Appartements dans Bouznika, Autre secteur",108 m²,2 chambres,2 sdbs,https://www.avito.ma/fr/autre_secteur/appartements/Appartement_avec_cour_%C3%A0_Bouznika_44799287.htm
Appartement 102m² à vendre Nouaceur,890000,"Appartements dans Nouaceur, Toute la ville",appartement 102m² à vendre nouaceur,2 chambres,2 sdbs,https://www.avito.ma/fr/nouaceur/appartements/Appartement_102m%C2%B2_%C3%A0_vendre_Nouaceur_55837867.htm
Appartement à vendre,11000,"Appartements dans Casablanca, Maarif",142 m²,3 chambres,2 sdbs,https://www.avito.ma/fr/maarif/appartements/Appartement_%C3%A0_vendre_57785030.htm
Appartement neuf 3 chambres 2 balcons et ascenseur,800000,"Appartements dans Marrakech, M'Hamid",,3 chambres,0 sdb,https://www.avito.ma/fr/m_hamid/appartements/Appartement_neuf_3_chambres_2_balcons_et_ascenseur_57732149.htm
Appartement rénové neuf à la Gironde,940000,"Appartements dans Casablanca, La Gironde",80 m²,2 chambres,2 sdbs,https://www.avito.ma/fr/la_gironde/appartements/Appartement_r%C3%A9nov%C3%A9_neuf_%C3%A0_la_Gironde_57717329.htm
Appartement meublé à vendre sur la route Ain Chkef Riyad Yasmin,400000,"Appartements dans Fès, Route Ain Chkaf",84 m²,2 chambres,2 sdbs,https://www.avito.ma/fr/route_ain_chkaf/appartements/Appartement_meubl%C3%A9_%C3%A0_vendre_sur_la_route_Ain_Chkef_Riyad_Yasmin_57050912.htm
Appartement à vendre 65 m² à Marrakech,700000,"Appartements dans Marrakech, Hay Targa",65 m²,3 chambres,2 sdbs,https://www.avito.ma/fr/hay_targa/appartements/Appartement_%C3%A0_vendre_65_m%C2%B2_%C3%A0_Marrakech_57585168.htm
Appartement à vendre 90 m² à Kénitra bir rami,560000,"Appartements dans Kénitra, Bir Rami",90 m²,3 chambres,1 sdb,https://www.avito.ma/fr/bir_rami/appartements/Appartement_%C3%A0_vendre_90_m%C2%B2_%C3%A0_K%C3%A9nitra_bir_rami_57770603.htm
Appartement à vendre à Mghogha – Tanger,230000,"Appartements dans Tanger, Mghogha",45 m²,1 chambre,1 sdb,https://www.avito.ma/fr/mghogha/appartements/Appartement_%C3%A0_vendre_%C3%A0_Mghogha___Tanger_57745830.htm
Appartement neuf à vendre à Almaz,1053000,"Appartements dans Casablanca, Almaz",,2 chambres,2 sdbs,https://www.avito.ma/fr/almaz/appartements/Appartement_neuf_%C3%A0_vendre_%C3%A0_Almaz_56084537.htm
sarout appartement 40m à bouchentouf,115000,"Appartements dans Casablanca, Al Fida",,2 chambres,1 sdb,https://www.avito.ma/fr/al_fida/appartements/sarout_appartement_40m_%C3%A0_bouchentouf_57237692.htm
Appartement double façade & Garçonnière,,"Appartements dans El Jadida, Saada",170 m²,4 chambres,3 sdbs,https://www.avito.ma/fr/saada/appartements/Appartement_double_fa%C3%A7ade___Gar%C3%A7onni%C3%A8re_57376124.htm
Appartement de trois chambres À VENDRE,,"Appartements dans Mohammedia, Al Qods",95 m²,3 chambres,2 sdbs,https://www.avito.ma/fr/al_qods/appartements/Appartement_de_trois_chambres_%C3%80_VENDRE_57712377.htm
Appartements neufs de 73m2 à 91m2 Résidence LINA,11000,"Appartements dans Marrakech, Targa",113 m²,2 chambres,3 sdbs,https://www.avito.ma/fr/targa/appartements/Appartements_neufs_de_73m2_%C3%A0_91m2_R%C3%A9sidence_LINA_56292699.htm
Appartement 78 m² à Vendre à Casa Sidi Maarouf,,"Appartements dans Casablanca, Sidi Maarouf",99 m²,2 chambres,2 sdbs,https://www.avito.ma/fr/sidi_maarouf/appartements/Appartement_78_m%C2%B2_%C3%A0_Vendre_%C3%A0_Casa_Sidi_Maarouf_55770708.htm
"Appart neuf 72,77,87m Sanaobar près Izdihar Charaf",936000,"Appartements dans Marrakech, Hay Izdihar",,3 chambres,0 sdb,https://www.avito.ma/fr/hay_izdihar/appartements/Appart_neuf_72_77_87m_Sanaobar_pr%C3%A8s_Izdihar_Charaf_57314465.htm
Appartement à vendre à Malabata Hills,,"Appartements dans Tanger, Malabata",120 m²,3 chambres,2 sdbs,https://www.avito.ma/fr/malabata/appartements/Appartement_%C3%A0_vendre_%C3%A0_Malabata_Hills_57746484.htm
Appartement à vendre à Ouad law,500000,"Appartements dans Tétouan, Autre secteur",,2 chambres,1 sdb,https://www.avito.ma/fr/autre_secteur/appartements/Appartement_%C3%A0_vendre_%C3%A0_Ouad_law_57745638.htm
Appartement à vendre 113m² Les roches de benslimane,850000,"Appartements dans Benslimane, Autre secteur",appartement à vendre 113m² les roches de benslimane,3 chambres,2 sdbs,https://www.avito.ma/fr/autre_secteur/appartements/Appartement_%C3%A0_vendre_113m%C2%B2_Les_roches_de_benslimane_57043869.htm
APPARTEMENT HAUT STANDING À RIVIERA,1900000,"Appartements dans Casablanca, Riviera",,2 chambres,3 sdbs,https://www.avito.ma/fr/riviera/appartements/APPARTEMENT_HAUT_STANDING_%C3%80_RIVIERA_57699025.htm
"À seulement 38 millions, superbe appartement de 3 chambres à Gzenaya",370000,"Appartements dans Tanger, la Nouvelle Ville Ibn Battouta",,3 chambres,2 sdbs,https://www.avito.ma/fr/la_nouvelle_ville_ibn_battouta/appartements/%C3%80_seulement_38_millions__superbe_appartement_de_3_chambres_%C3%A0_Gzenaya_57531482.htm
Appartement à vendre 170 m² à Rabat,3450000,"Appartements dans Rabat, Hay Riad",170 m²,3 chambres,2 sdbs,https://www.avito.ma/fr/hay_riad/appartements/Appartement_%C3%A0_vendre_170_m%C2%B2_%C3%A0_Rabat_57833782.htm
Appartement à vendre 58 m² à Marrakech,1350000,"Appartements dans Marrakech, Victor Hugo",appartement à vendre 58 m² à marrakech,1 chambre,2 sdbs,https://www.avito.ma/fr/victor_hugo/appartements/Appartement_%C3%A0_vendre_58_m%C2%B2_%C3%A0_Marrakech_57606723.htm
Appartement à vendre 85 m² à Casablanca,950000,"Appartements dans Casablanca, Belvédère",appartement à vendre 85 m² à casablanca,2 chambres,1 sdb,https://www.avito.ma/fr/belv%C3%A9d%C3%A8re/appartements/Appartement_%C3%A0_vendre_85_m%C2%B2_%C3%A0_Casablanca_54418643.htm
CMN-AN-1884 - Appartement à vendre à Bourgogne,1300000,"Appartements dans Casablanca, Bourgogne",80 m²,2 chambres,1 sdb,https://www.avito.ma/fr/bourgogne/appartements/CMN_AN_1884___Appartement_%C3%A0_vendre_%C3%A0_Bourgogne_57370097.htm
CMN-SI-1879 - Appartement à vendre à Ziraoui,3480000,"Appartements dans Casablanca, Bourgogne",260 m²,3 chambres,2 sdbs,https://www.avito.ma/fr/bourgogne/appartements/CMN_SI_1879___Appartement_%C3%A0_vendre_%C3%A0_Ziraoui_57331613.htm
Appartement d'Exception Vue Panoramique à Hassan,3890000,"Appartements dans Rabat, Hassan",,3 chambres,2 sdbs,https://www.avito.ma/fr/hassan/appartements/Appartement_d_Exception_Vue_Panoramique_%C3%A0_Hassan_57723200.htm
3 Chambres à vendre 112 m² à Californie,2000000,"Appartements dans Casablanca, Californie",117 m²,3 chambres,2 sdbs,https://www.avito.ma/fr/californie/appartements/3_Chambres_%C3%A0_vendre_112_m%C2%B2_%C3%A0_Californie_56564980.htm
Appartement à Atlas golf Resort à Marrakech,2100000,"Appartements dans Marrakech, Annakhil",140 m²,2 chambres,2 sdbs,https://www.avito.ma/fr/annakhil/appartements/Appartement_%C3%A0_Atlas_golf_Resort_%C3%A0_Marrakech_57615030.htm
Appartement à vendre à Settat,200000,"Appartements dans Settat, Toute la ville",,2 chambres,1 sdb,https://www.avito.ma/fr/settat/appartements/Appartement_%C3%A0_vendre_%C3%A0_Settat_56272168.htm
CMN-SI-1879 - Appartement à vendre à Ziraoui,3480000,"Appartements dans Casablanca, Bourgogne",260 m²,3 chambres,2 sdbs,https://www.avito.ma/fr/bourgogne/appartements/CMN_SI_1879___Appartement_%C3%A0_vendre_%C3%A0_Ziraoui_57331613.htm
Appartement 3 chambres à vendre 117 m² à Marrakech,,"Appartements dans Marrakech, Route de Safi",117 m²,3 chambres,2 sdbs,https://www.avito.ma/fr/route_de_safi/appartements/Appartement_3_chambres_%C3%A0_vendre_117_m%C2%B2_%C3%A0_Marrakech_57546872.htm
Appartement à vendre 180 m² à Casablanca,2700000,"Appartements dans Casablanca, Maarif",200 m²,4 chambres,3 sdbs,https://www.avito.ma/fr/maarif/appartements/Appartement_%C3%A0_vendre_180_m%C2%B2_%C3%A0_Casablanca_57839155.htm
Appartement 122m² à Belvédère à vendre à Casa.,1100000,"Appartements dans Casablanca, Belvédère",appartement 122m² à belvédère à vendre à casa.,2 chambres,2 sdbs,https://www.avito.ma/fr/belv%C3%A9d%C3%A8re/appartements/Appartement_122m%C2%B2_%C3%A0_Belv%C3%A9d%C3%A8re_%C3%A0_vendre_%C3%A0_Casa__54407975.htm
Appartement à vendre 120m² H Mohammadi Casablanca,850000,"Appartements dans Casablanca, Hay Mohammadi",120 m²,2 chambres,1 sdb,https://www.avito.ma/fr/hay_mohammadi/appartements/Appartement_%C3%A0_vendre_120m%C2%B2_H_Mohammadi_Casablanca_57309014.htm
Élégant Studio à vendre 63 m² à Marrakech,1134000,"Appartements dans Marrakech, Guéliz",63 m²,1 chambre,1 sdb,https://www.avito.ma/fr/gu%C3%A9liz/appartements/%C3%89l%C3%A9gant_Studio_%C3%A0_vendre_63_m%C2%B2_%C3%A0_Marrakech_57765732.htm
Appartement Hiba 135m avec ascenseur et garage,,"Appartements dans Tamesna, Toute la ville",,3 chambres,3 sdbs,https://www.avito.ma/fr/tamesna/appartements/Appartement_Hiba_135m_avec_ascenseur_et_garage_56519671.htm
VENTE D’UN BEL APPARTEMENT DE 117M2,1900000,"Appartements dans Casablanca, Les Princesses",117 m²,3 chambres,2 sdbs,https://www.avito.ma/fr/les_princesses/appartements/VENTE_D_UN_BEL_APPARTEMENT_DE_117M2_56886880.htm
2 Ou 3 Pièces Avec Piscine Au Coeur De Marrakech,870000,"Appartements dans Marrakech, Route de Casablanca",,1 chambre,1 sdb,https://www.avito.ma/fr/route_de_casablanca/appartements/2_Ou_3_Pi%C3%A8ces_Avec_Piscine_Au_Coeur_De_Marrakech_57764279.htm
Appartement 236m² à Gauthier Consulat d'Italie,3200000,"Appartements dans Casablanca, Gauthier",272 m²,4 chambres,3 sdbs,https://www.avito.ma/fr/gauthier/appartements/Appartement_236m%C2%B2_%C3%A0_Gauthier_Consulat_d_Italie_56634956.htm
Appartement à vendre 78 m² à Deroua,460000,"Appartements dans Deroua, Toute la ville",78 m²,2 chambres,1 sdb,https://www.avito.ma/fr/deroua/appartements/Appartement_%C3%A0_vendre_78_m%C2%B2_%C3%A0_Deroua_57721736.htm
Appartement à vendre à Sonaba,2200000,"Appartements dans Agadir, Founty",,3 chambres,2 sdbs,https://www.avito.ma/fr/founty/appartements/Appartement_%C3%A0_vendre_%C3%A0_Sonaba_57486945.htm
Appartement Moderne à Yassmine Bouskoura,,"Appartements dans Bouskoura, Bouskoura centre",51 m²,2 chambres,2 sdbs,https://www.avito.ma/fr/bouskoura_centre/appartements/Appartement_Moderne_%C3%A0_Yassmine_Bouskoura_57606479.htm
Appartement à vendre 134 m² à Casablanca,3000000,"Appartements dans Casablanca, Racine",154 m²,3 chambres,3 sdbs,https://www.avito.ma/fr/racine/appartements/Appartement_%C3%A0_vendre_134_m%C2%B2_%C3%A0_Casablanca_57789942.htm
Appartement à vendre 97 m² à Meknès,,"Appartements dans Meknès, Ville Nouvelle",102 m²,3 chambres,2 sdbs,https://www.avito.ma/fr/ville_nouvelle/appartements/Appartement_%C3%A0_vendre_97_m%C2%B2_%C3%A0_Mekn%C3%A8s_57274144.htm
Bel appartement... orientation sud,2150000,"Appartements dans Casablanca, Les Princesses",165 m²,3 chambres,2 sdbs,https://www.avito.ma/fr/les_princesses/appartements/Bel_appartement____orientation_sud_56943177.htm
Appartement en face de la plage 72 m² à Martil.,1200000,"Appartements dans Martil, Toute la ville",72 m²,2 chambres,1 sdb,https://www.avito.ma/fr/martil/appartements/Appartement_en_face_de_la_plage_72_m%C2%B2_%C3%A0_Martil__56700135.htm
Appartement neuf à vendre dans le quartier Al-Azhar – Bernoussi (Casablanca),,"Appartements dans Casablanca, Autre secteur",,3 chambres,2 sdbs,https://www.avito.ma/fr/autre_secteur/appartements/Appartement_neuf_%C3%A0_vendre_dans_le_quartier_Al_Azhar___Bernoussi__Casablanca__56592050.htm
Appartement à vendre 176 m² à Tanger,3500000,"Appartements dans Tanger, Administratif",176 m²,4 chambres,2 sdbs,https://www.avito.ma/fr/administratif/appartements/Appartement_%C3%A0_vendre_176_m%C2%B2_%C3%A0_Tanger_57778075.htm
Appartements à vendre,2432000,"Appartements dans Agadir, Haut-Founty",128 m²,3 chambres,3 sdbs,https://www.avito.ma/fr/haut_founty/appartements/Appartements_%C3%A0_vendre_57804375.htm
Appartement à vendre 78 m² à Marrakech,1800000,"Appartements dans Marrakech, Agdal",118 m²,2 chambres,2 sdbs,https://www.avito.ma/fr/agdal/appartements/Appartement_%C3%A0_vendre_78_m%C2%B2_%C3%A0_Marrakech_56438709.htm
Appartement à vendre 105 m² à Casablanca maarif,1450000,"Appartements dans Casablanca, Les Princesses",appartement à vendre 105 m² à casablanca maarif,2 chambres,2 sdbs,https://www.avito.ma/fr/les_princesses/appartements/Appartement_%C3%A0_vendre_105_m%C2%B2_%C3%A0_Casablanca_maarif_57532917.htm
Appartement à vendre 60 m² à Tanger,,"Appartements dans Tanger, Marjane",60 m²,2 chambres,1 sdb,https://www.avito.ma/fr/marjane/appartements/Appartement_%C3%A0_vendre_60_m%C2%B2_%C3%A0_Tanger_57824346.htm
Appartement à vendre 172 m² à Casablanca,2100000,"Appartements dans Casablanca, 2 Mars",172 m²,3 chambres,3 sdbs,https://www.avito.ma/fr/2_mars/appartements/Appartement_%C3%A0_vendre_172_m%C2%B2_%C3%A0_Casablanca_57382833.htm
